datetime,title,content
2020-08-31 20:00:00 -0400,Facebook Threatens to Cut Off Australians From Sharing News,"(Bloomberg) -- Facebook Inc. plans to block people and publishers in Australia from sharing news, a move that pushes back against a proposed law forcing the company to pay media companies for their articles.The threat escalates an antitrust battle between Facebook and the Australian government, which wants the social-media giant and Alphabet Inc.’s Google to compensate publishers for the value they provide to their platforms.The legislation still needs to be approved by Australia’s parliament. Under the proposal, an arbitration panel would decide how much the technology companies must pay publishers if the two sides can’t agree.Facebook said in a blog posting Monday that the proposal is unfair and would allow publishers to charge any pric..."
2020-08-31 18:40:03 -0400,Facebook partners with external researchers to study its impact during U.S. election,"The initiative expands on its Social Science One project with academics who study political impacts of social media.  A group of 17 independent researchers from the fields of elections, democracy and social media will now work with internal Facebook data scientists to design the studies.  The company expects between 200,000 and 400,000 users to opt into the project, which will log what they see and how they behave on Facebook and Instagram."
2020-08-31 18:00:07 -0400,You Think FAANG Is Distorting the S&P? Consider ATM,"(Bloomberg Opinion) -- Many have lamented the lack of depth in the U.S. stock market, marveling at how a handful of big tech companies have grown to dominate almost a quarter of the S&P 500 and become responsible for all of this year’s gain. But that lopsidedness is nothing next to China, where the top three stocks in the benchmark MSCI China Index now have more than a 38% weight. At this rate, instead of buying passive funds that track the MSCI index, investors might as well just pile into China’s version of FAANG, known locally as ATM: Alibaba Group Holding Ltd., Tencent Holdings Ltd. and food delivery super-app Meituan Dianping. There’s nagging unease that ATM’s economic prospects aren’t as sound as those of Facebook Inc., Apple Inc., ..."
2020-08-31 17:08:29 -0400,Missed the Zoom Boom? It Still Has a Ways to Go,"(Bloomberg Opinion) -- Sometimes the little guy with the better mousetrap can beat the tech Goliaths. That is certainly the case with upstart Zoom Video Communications Inc. this year.Late Monday, the video-conferencing company posted strong July-quarter sales results that handily beat Wall Street estimates. Zoom reported second-quarter revenue of $663.5 million, up 355% from a year earlier, versus the $500 million Bloomberg consensus. It also projected a sales range of $685 million to $690 million for the current quarter, which is higher than the $493 million average analyst estimate. Zoom shares rose in after-hours trading, adding to their more than fourfold gains year to date. Zoom got a big boost this year as the Covid-19 pandemic forc..."
2020-08-31 16:00:00 -0400,Facebook Grants Researchers Access to Study 2020 Election,"(Bloomberg) -- Facebook Inc. is working with a group of third-party researchers to study how content and user behavior on the social network’s apps affect the 2020 election.A group of 17 university researchers will look at how Facebook and Instagram influence issues such as political polarization, and whether people vote, said Talia Stroud, a communications professor at the University of Texas who is co-charing the research group. Users must consent to participate, and will be paid, says Chaya Nayak, who leads Facebook’s open research and transparency team. While Facebook is covering the costs to participants, the researchers are not taking money from the company. The researchers won’t need Facebook’s approval before it can publish its fi..."
2020-08-31 11:36:44 -0400,Facebook partially documents its content recommendation system - TechCrunch,TechCrunch
2020-08-31 01:00:08 -0400,China Throws a Wrench Into Trump’s Plan to Force TikTok Sale,"(Bloomberg) -- Zhang Yiming’s plan to sell the U.S. operations of his short-video app TikTok to avoid a shutdown was thrown into jeopardy after China asserted its authority over a deal already under scrutiny by the Trump administration.Beijing on Friday injected more uncertainty into already thorny negotiations over the sale of ByteDance Ltd.’s prized asset, claiming the ability to block a sale to foreign suitors Microsoft Corp. or Oracle Corp. with tighter restrictions on artificial intelligence exports. The commerce ministry added speech and text recognition and personalized recommendations to a list of products that require approval before they’re sold abroad.These new areas cover the very technologies ByteDance employed to make TikTok..."
2020-08-30 21:01:17 -0400,China Just Called Trump's Bluff on TikTok,"(Bloomberg Opinion) -- Imagine a bidder wanting to buy KFC, but being told the deal might not include the Colonel’s seven secret herbs and spices. That’s effectively what Beijing has told the list of U.S. companies keen to purchase short-video app TikTok: The key ingredients may be out of reach. At first it looked like the Trump administration had it all figured out. ByteDance Inc., it decided, was a risk to national security and the Chinese company’s main product for international markets had to be sold. For reasons that remain confounding, Satya Nadella entered the fray and Microsoft Corp. put in a bid. Soon, suitors were apparently lining up to buy the hip new product that claims 100 million U.S. downloads. A short deadline — Sept. 15 ..."
2020-08-30 11:24:00 -0400,Zuckerberg calls Facebook’s failure to take down Kenosha militia post ‘largely an operational mistake’,CEO and co-founder of social-media giant offers no apology for not removing the post flagged by numerous Facebook users inviting armed militia members to converge on the Wisconsin city amid protests over the police shooting of Jacob Blake.
2020-08-29 12:21:26 -0400,Trump Takes Aim at Protests As Facebook Apologizes: Protest Wrap,"(Bloomberg) -- President Donald Trump took aim at people protesting racism and police brutality, saying they are “just looking for trouble” and don’t know about the killing of a Black man at the hands of police in Minneapolis that led to demonstrations nationally.“They’re not protesters,” Trump said Friday at a rally at the airport in Manchester, New Hampshire. “Those are anarchists, they’re agitators, they’re rioters, they’re looters.”The comments came as thousands gathered Friday at the Lincoln Memorial to demand racial equality and criminal justice reform in what they called the “Get Your Knee Off Our Necks” march on the 57th anniversary of Martin Luther King Jr.’s “I Have a Dream Speech.”The event in Washington set the stage for a wee..."
2020-08-29 11:31:03 -0400,Facebook Up 25.2% Since Last Earnings Report: Can It Continue?,Facebook (FB) reported earnings 30 days ago. What's next for the stock? We take a look at earnings estimates for some clues.
2020-08-29 09:36:01 -0400,Mark Zuckerberg Admits Facebook ‘Operational Mistake’ in Failing to Pull Wisconsin Militia Group,"Facebook CEO Mark Zuckerberg conceded in a town-hall meeting with employees this week that the social giant fell down on the job in failing to remove a militia group's &quot;call to arms&quot; that had urged followers to engage in violence amid the unrest in Kenosha, Wisc., following the shooting of a Black man. “It was […]"
2020-08-28 21:07:45 -0400,Factbox: What is QAnon and how are social media sites handling it?,"A core tenet of the conspiracy theory is that U.S. President Donald Trump is secretly fighting a cabal of child-sex predators that includes prominent Democrats, Hollywood elites and ""deep state"" allies.  QAnon, which borrows some elements from the bogus ""pizzagate"" theory about a pedophile ring run out of a Washington restaurant, has become a ""big tent"" conspiracy theory encompassing misinformation about topics ranging from alien landings to vaccine safety.  QAnon has been amplified on Twitter, Facebook, Instagram and YouTube, the video streaming service of Alphabet Inc's Google."
2020-08-28 20:13:57 -0400,Is Facebook a Buy After Shops Feature Expansion? This Analyst Says ‘Yes’,"In the current stay-at-home environment, it’s all about e-Commerce. While the shift from brick-and-mortar retail to online shopping had already been underway for quite some time, COVID-19's romp around the globe certainly accelerated it. To this end, companies everywhere are making a significant effort to keep up with the trend.This includes the likes of social media titan Facebook (FB). Back in May, the company launched its Shops product on a limited basis, offering it to only select businesses. Writing for Stifel, 5-star analyst John Egbert notes “this offering provides SMBs with the ability to build a unified transactional storefront across Facebook Pages and Instagram business profiles with direct customer service integrations through..."
2020-08-28 19:23:38 -0400,Facebook CEO Says ‘Kenosha Guard’ Page Was Left Up By Mistake,"(Bloomberg) -- Facebook Inc. Chief Executive Officer Mark Zuckerberg said the company was too slow to remove a page that violated its policy on dangerous organizations in the hours leading up to a deadly shooting in Kenosha, Wisconsin, this week.The social-media company eventually took down the page, titled “Kenosha Guard,” for violating Facebook policies around militia organizations, according to a spokeswoman. The page’s owners created an event promoting a “call to arms” and encouraging users to “Protect our Lives and Property,” the Verge reported. Multiple users reported the group to Facebook but it was not removed until after a shooting on Tuesday in which two people died.Read more: Kenosha Exposes Ugly Truth of Inequality in America’..."
2020-08-28 17:33:56 -0400,Zuckerberg says Facebook's failure to remove militia page 'an operational mistake',"The page and event listing violated Facebook's policies and should have been removed after the company received numerous complaints about the group's violent nature, Zuckerberg said in a video to employees posted publicly on his Facebook profile.  The social media company removed the page for 'Kenosha Guard' and an event listing for 'Armed Citizens to Protect Our Lives and Property' after the shootings on Tuesday night."
2020-08-28 16:25:00 -0400,"Alphabet Inc. Cl A stock rises Friday, still underperforms market","COMPANY CLOSE UPDATES  Terrence Horan Shares of Alphabet Inc. Cl A GOOGL inched 0.67% higher to $1,639.43 Friday, on what proved to be an all-around favorable trading session for the stock market, with the S&P 500 Index SPX rising 0."
2020-08-28 15:55:00 -0400,Facebook Says Apple Blocked It From Informing About App Store 30% Fee,Facebook wanted to tell Apple device users that a new paid-online events feature in its app would incur the charge.
2020-08-28 06:23:00 -0400,"During the Pandemic and Beyond, Which Stock Is a Better Buy: MercadoLibre or Facebook?","The shelter-in-place orders and resulting trend towards remote work shifted the digital transformation into high gear, giving some companies a significant advantage over their peers.  Among the biggest beneficiaries were e-commerce, cloud computing, digital payments, streaming video and music, and social media.  Within that group are two companies in different areas of technology that have been among the biggest performers in the sector over the past decade: social media giant Facebook (NASDAQ: FB) and Latin American e-commerce and payments powerhouse MercadoLibre (NASDAQ: MELI), which have gained 635% and 1,560%, respectively, over the past 10 years."
2020-08-26 20:03:05 -0400,"S&P 500 Gains 35 Points, Another Record High as Tech Giants Soar","When four stocks with more than $1.4 trillion in market cap gain 8% or more, the market goes along for the ride."
2020-08-26 17:15:11 -0400,TikTok May Be the Competition Facebook Needs: Rep. Cicilline,"Aug.26 -- U.S. Representative David Cicilline, a Rhode Island Democrat, discusses his views on a U.S. company potentially buying the video-sharing app TikTok, and his investigation into big tech companies with Emily Chang on ""Bloomberg Technology."""
2020-08-26 16:37:18 -0400,Facebook Climbs Above $300 for First Time on E-Commerce Bets,"(Bloomberg) -- Facebook Inc.’s gains accelerated Wednesday, sending shares higher by 8.2%, as analysts hailed a new shopping section on its namesake social network, projecting strong e-commerce growth potential.The stock closed at a record $303.91, rising for a third straight day. JMP Securities, which rates Facebook at a buy-equivalent rating of market outperform with a price target of $305, said there are “multiple catalysts” for Facebook, and e-commerce “can be a significant opportunity.” There is “a clear line of sight to monetizing” the new section, dubbed Facebook Shop, according to analyst Ronald Josey.While advertising should remain Facebook’s focus, the growth in e-commerce means the site “can generate greater product discovery” ..."
2020-08-26 15:57:00 -0400,Facebook Claims an Apple iPhone Update Will Damage Ad Sales,"Facebook (NASDAQ: FB) and Apple (NASDAQ: AAPL), never the best of tech industry friends, are at odds over the latter's upcoming update to the iPhone's operating system.  In an official company blog post today, Facebook wrote that due to changes being implemented in iOS 14, ""[o]ur ability to deliver targeted ads on iOS 14 will be limited.""  ""As a result, some iOS 14 users may not see any ads from Audience Network, while others may still see ads from us, but they'll be less relevant,"" the company said."
2020-08-26 13:00:27 -0400,TikTok Faces Government Restrictions on U.K. Expansion Drive,"(Bloomberg) -- Boris Johnson’s top advisers may impose restrictions on TikTok’s activities in the U.K., but are likely to stop short of blocking plans by the Chinese-owned social media app to set up an international headquarters in London.A review led by the prime minister’s chief of staff Eddie Lister is likely to find the app doesn’t pose as big a security threat as Huawei Technologies Co., but may still recommend the government stops the company from moving users’ data out of the country, said a person with knowledge of the discussions who asked not to be identified because the talks are private.The popular video-sharing app, owned by Chinese tech company ByteDance Ltd., is battling critics concerned it could be used by Beijing to spy ..."
2020-08-26 11:53:53 -0400,"Forget Facebook, Match Group Is a Better Online Dating Stock","Last September, Facebook (NASDAQ: FB) launched Facebook Dating in the U.S. after testing the feature in other markets for a year.  Earlier this year, Facebook upgraded the feature with video calls to let users go on ""virtual"" dates as the COVID-19 crisis kept more people at home.  Facebook's expansion into the online dating market initially spooked investors in Match Group (NASDAQ: MTCH), which owns popular dating apps like Tinder, Match, PlentyOfFish, OurTime, OkCupid, and Hinge."
2020-08-26 11:35:00 -0400,Facebook nears $300 per share for first time,Facebook Inc.  shares were up 5% to $295.95 in late-morning trading Wednesday as the social-networking giant neared $300 a share for the first time. Facebook's stock is up 44% this year. The broader S&P 500 index  is up 7% this year.
2020-08-26 10:58:00 -0400,"The stock market’s rebound is nowhere near over, and mid-cap exposure is probably what you need",Research into stock market disruptions and recoveries shows conventional wisdom about large-cap stocks is wrong.
2020-08-26 09:14:56 -0400,Facebook updates Messenger Rooms as Zoom sits at top of the App Store - TechCrunch,TechCrunch
2020-08-26 04:47:45 -0400,Thai minister says clampdown won't stop as Facebook plans to fight order,"Thailand's digital minister vowed no relent on Wednesday in a crackdown on social media content deemed illegal and said it was unlikely Facebook would follow through on plans to challenge an order to block access to a group critical of the Thai monarchy.  The ""Royalist Marketplace"" group, which had over 1 million members, was blocked within Thailand late on Monday after the digital ministry threatened legal action against Facebook under the country's Computer Crime Act.  Facebook <FB.O> said it was compelled to comply and would mount a legal challenge in court."
2020-08-26 01:00:11 -0400,Women Have Been Better Leaders Than Men During the Pandemic,"(Bloomberg Opinion) -- The evidence is in: At least during the first wave of Covid-19, countries with female leaders suffered far lower death rates than comparable nations led by men. This doesn’t mean that the trend will necessarily persist in a second or third wave. Nor does it imply that women are also better leaders when it comes to whatever else governments find themselves doing, from reforming labor markets to waging war. But it’s worth pondering nonetheless.In doing so, it’s of course tempting to descend into the netherworld of gender stereotypes and individual caricature. Donald Trump, president of the country with the most deaths from Covid-19, has communicated with an uninformed machismo that has provoked reactions ranging from ..."
2020-08-25 19:05:00 -0400,Facebook and Twitter are concerned about what is going to happen after Election Day,"In what is shaping up as a newfangled nightmare in their efforts to stop election interference, Facebook Inc., Twitter Inc. and others are as concerned about misinformation and other issues in days after the U.S. election as they are in the months preceding it."
2020-08-25 19:01:00 -0400,"What to Know About Palantir, the Latest Tech Company to File to Go Public",The secretive data-analytics company made public the regulatory filing for its long-awaited initial public offering.
2020-08-25 18:41:38 -0400,Facebook Inc Is The Third Most Popular Stock Among Hedge Funds,Insider Monkey has processed numerous 13F filings of hedge funds and successful value investors to create an extensive database of hedge fund holdings. The 13F filings show the hedge funds' and successful investors' positions as of the end of the second quarter. You can find articles about an individual hedge fund's trades on numerous financial […]
2020-08-25 17:22:00 -0400,Facebook Has a New Top Bull on Wall Street,"UBS analyst Eric Sheridan set a target for the stock price of $330, while the shares closed at $280.82 on Tuesday."
2020-08-25 13:44:00 -0400,"Facebook, Twitter execs are bracing for protecting integrity during upcoming elections","Security executives from Facebook Inc.  and Twitter Inc.  are gearing up for a long run-up to election night, and the days following it. They are teaming up with academia, media, cybersecurity companies, and intelligence officials. &quot;How do we ensure that voters have accurate information&quot; as election results are counted in the days following the Nov. 3 presidential election?, Nathaniel Gleicher, Facebook's head of security policy, said during a webinar on protecting the upcoming elections on Tuesday. He said more &quot;bad actors&quot; are being detected, compared with elections in 2016 and 2018 through a greater understanding of the risk, and through coordination with media and state and local officials. Yoel Roth, head of site ..."
2020-08-25 13:25:45 -0400,"Facebook Updates Shops, Expands Instagram Live Shopping","Facebook unveils a new Shops section, plus new merchant tools, more messaging and a broader rollout of Instagram Live Shopping."
2020-08-25 10:54:05 -0400,"Facebook plans news service launch in UK, India, Brazil","The social media giant's news service currently pays U.S. publishers for content and has original reporting from more than 200 outlets, including thousands of local news organizations.  Facebook, which has 2.7 billion monthly active users, has come under fire for its lax approach to fake news reports"
2020-08-25 07:32:00 -0400,Facebook agrees to pay France $125 million to settle dispute over 10 years of back taxes,Facebook will pay the French government €106 million ($125 million) in back taxes to settle a dispute that began with a raid on the tech company’s Paris offices in 2012.
2020-08-25 07:17:00 -0400,"These ‘Dividend Aristocrat’ stocks have been raising their dividends for decades, and there have been no dividend cuts during the pandemic","DEEP DIVE  In a year of so much uncertainty, having a bit of surety about your investments is a luxury.  The S&P 500 Dividend Aristocrats — stocks of 65 companies that have increased their dividends for at least 25 years — have been solid, in that none of them have cut their payouts."
2020-08-25 00:05:17 -0400,Facebook says plans to challenge Thai government demand to block group critical of monarchy,"Facebook <FB.O> said on Tuesday it was planning to legally challenge the Thai government after being ""compelled"" to block access within Thailand to a group with 1 million members that discusses the country's king.  The social media giant late on Monday blocked access to the ""Royalist Marketplace"" group after the Thai government threatened legal action over failure to take down content deemed defamatory to the monarchy.  ""Requests like this are severe, contravene international human rights law, and have a chilling effect on people's ability to express themselves,"" a Facebook spokesperson said in a statement to Reuters."
2020-08-24 23:49:44 -0400,India’s New Economy Can’t Be a Monopoly Board,"(Bloomberg Opinion) -- Two years ago, India rolled out a laudable plan to unlock the capital trapped in some of its smaller airports. But the actual outcome from privatization was less than reassuring: All six airfields put on the block went to one bidder. If that wasn’t enough, multiple media reports now say that Ahmedabad, Gujarat-based billionaire Gautam Adani, an early and enthusiastic supporter of Prime Minister Narendra Modi, might also succeed in taking control of the already-privatized Mumbai airport, as well as a new one coming up on the financial center’s outskirts. Airports are natural monopolies. To have one private owner controlling eight or more — a fresh batch of six will soon go under the hammer — can’t possibly be great n..."
2020-08-24 17:44:00 -0400,Facebook co-founder's Asana caps wild day of IPO plans with filing for a direct listing,"Asana Inc., a software &quot;unicorn&quot; started by a Facebook Inc.  co-founder, formally announced its intention to list its shares on the public markets Monday afternoon, capping a wild day for software filings. Asana was at least the fifth software startup to announce its intention to go public Monday, following filings from Snowflake Inc., Unity Software Inc., Sumo Logic and Jfrog Ltd. Asana is taking a different route than the others with a direct listing, which fellow workplace-communications and -organization software company Slack Technologies Inc. also employed to go public. Asana was co-founded by Facebook co-founder Dustin Moskovitz 11 years ago, and he still runs the company as president, chief executive and chair and will m..."
2020-08-24 16:25:00 -0400,"Alphabet Inc. Cl A stock rises Monday, still underperforms market","COMPANY CLOSE UPDATES  Terrence Horan Shares of Alphabet Inc. Cl A GOOGL inched 0.61% higher to $1,585.15 Monday, on what proved to be an all-around favorable trading session for the stock market, with the S&P 500 Index SPX rising 1."
2020-08-24 13:42:00 -0400,Facebook blocks group of one million critical of Thai monarchy amid government pressure,"Facebook on Monday blocked access within Thailand to a group with 1 million members that discusses the country's king, after the Thai government threatened legal action over failure to take down content deemed defamatory to the monarchy.  The move comes amid near daily youth-led protests against the government led by the former military junta chief and unprecedented calls for reforms of the monarchy.  The ""Royalist Marketplace"" group was created in April by Pavin Chachavalpongpun, a self-exiled academic and critic of the monarchy."
2020-08-24 12:51:00 -0400,Tencent Earns Relative Strength Rating Upgrade,"On Monday, Tencent hit a noteworthy performance benchmark, with its Relative Strength (RS) Rating moving into the 90-plus percentile with an improvement to 91, a rise from 88 the day before.  When looking for the best stocks to buy and watch, one factor to watch closely is relative price strength.  IBD's unique RS Rating identifies technical performance by showing how a stock's price action over the last 52 weeks compares to that of the other stocks in our database."
2020-08-24 12:37:40 -0400,Facebook agrees to pay France €106m in back taxes,The social networking giant has also agreed to pay France 50% more tax for 2020.
2020-08-24 03:59:07 -0400,Facebook to pay 104 million euros in back taxes in France - media,"Facebook France has accepted paying more than 100 million euros in taxes, including a penalty, relating to its accounting years before 2018, French financial magazine Capital reported on its website.  Facebook was not immediately available for comment.  The French Finance Ministry said it could not comment on individual tax cases."
