datetime,title,content
2020-06-17 10:54:00 -0400,The first crack appears in bulls’ thesis that the stock market will rise no matter what,Money printing by the Federal Reserve has propelled stocks for more than a decade. But that effect may soon wear off.
2020-06-17 10:30:34 -0400,Bolsonaro’s Brazil Breeds Internet Pundits,"(Bloomberg Opinion) -- The angry dude on Twitter had the look of a man with few friends and a message to match. Brazilian democracy faced grave peril, he warned, scolding apolitical artists, singers and web celebrities to speak out against “fascist” right-wing President Jair Bolsonaro.Brazilians have heard this before. Just not from Felipe Neto, a celebrity web jockey famed for his online antics, carnival coif and the pied-piper hold he exerts on millions of teens and tweenagers. While Neto’s getup — a pink t-shirt emblazoned with before and after portraits of Cinderella — was familiar, the gravitas was new. “We are officially up against a fascist regime,” he pealed.  “Anyone who stays silent before fascism is a fascist.”Not every web inf..."
2020-06-17 10:01:00 -0400,"Alphabet, Amazon and Facebook willing to have their CEOs testify before House panel, while Apple doesn’t commit","In the wake of news that Amazon’s Jeff Bezos is willing to testify before the House Judiciary Committee, which is conducting an antitrust investigation aimed at Big Tech, multiple published reports say Facebook’s Mark Zuckerberg and Google parent Alphabet’s Sundar Pichai also are agreeing to appear."
2020-06-17 10:00:31 -0400,Big Tech Won’t Be the Same If Everyone Works From Home,"(Bloomberg Opinion) -- As the coronavirus pandemic continues, Bloomberg Opinion will be running a series of features by our columnists that consider the long-term consequences of the crisis. This column is part of a package on the future of tech and innovation.There’s no question that we are being saved by technology during the pandemic, as we use Zoom for our education and entertainment and rely on Amazon for just about everything else. Still, we may need to worry whether Big Tech itself will retain its strength in innovation after the crisis, given that companies won’t have as many employees working side by side in the office anymore. About 60% of Americans who have been working from home say they would like to continue doing so once th..."
2020-06-17 08:28:51 -0400,"Facebook, Instagram Will Let Users Turn Off All Political Ads","Amid criticism over Facebook's policy to not fact-check political ads, the social giant is giving users a new option: They can choose to disable political advertising. Facebook announced the new feature as it touted the launch of a new U.S. voter-registration drive -- under which it hopes to sign up 4 million voters this year […]"
2020-06-17 07:37:00 -0400,Dow futures rise as stock market tries for 4th straight gain on hope of a V-shaped bounce economic recovery coronavirus,"U.S. stock-index futures pointed to a fourth day of gains on Wall Street, but investors were contending with some evidence of a second wave coronavirus outbreak in China just as economies around the world begin to recover."
2020-06-17 06:47:00 -0400,"There’s a one-in-three chance of a ‘massive’ disaster that could be worse than COVID-19, says Deutsche Bank",Deutsche Bank says there is at least a one-in-three chance that at least one of four major tail risks will occur within the next decade.
2020-06-17 06:09:00 -0400,Central bank digital currencies would ‘increase government’s grip on money’ with few benefits for the rest of us,"Money transfers and bank clearing would be faster, but governments would have greater financial-surveillance powers."
2020-06-17 01:06:02 -0400,Facebook to let users turn off political adverts,The decision comes after the social network faced criticism over false information in political ads.
2020-06-16 22:34:00 -0400,"Facebook launches voting information hub, but still won’t block Trump misinformation",Facebook is launching a widespread effort to boost U.S. voter turnout and provide authoritative information about voting — just as it doubles down on its policy allowing politicians like President Donald Trump to post false information on the same subject.
2020-06-16 22:11:48 -0400,Facebook closes political ads loophole ahead of U.S. presidential election,"Facebook Inc said on Tuesday it would affix labels to political ads shared by users on their own feeds, closing what critics have said for years was a glaring loophole in the company's election transparency measures.  The world's biggest social network has attached a ""paid for by"" disclaimer to political ads since 2018, after facing a backlash for failing to stop Russia from using its platforms to influence the 2016 U.S. presidential election.  ""Previously the thinking here was that these were organic posts, and so these posts did not necessarily need to contain information about ads,"" said Sarah Schiff, a Facebook product manager overseeing the change."
2020-06-16 20:22:55 -0400,Facebook removes hundreds more accounts as right-wing violence spreads,"Facebook on Tuesday removed almost 900 accounts associated with the far-right Proud Boys and American Guard, including those belonging to Proud Boys supporters who marched into a protest zone in Seattle Monday and confronted anti-racist demonstrators.  Facebook told Reuters the takedowns of more than 500 Facebook accounts and more than 300 Instagram accounts followed a smaller round of suspensions two weeks ago.  ""We initially removed a set of accounts for both organizations on May 30 when we saw that both organizations started posting content tied to the ongoing protests,"" said a Facebook spokeswoman who asked not to be identified."
2020-06-16 18:24:15 -0400,Cielo S.A. -- Moody's affirms Cielo's Ba1 rating; stable outlook,"Moody's America Latina, (""Moody's"") affirmed Cielo S.A. (""Cielo"")'s Aaa.br national scale corporate family rating (CFR).  The ratings on the Ba1/Aaa.br senior unsecured debentures issued by Cielo were also affirmed.  At the same time, Moody's Investors Service affirmed Cielo's Ba1 corporate family rating and the Ba1 ratings on the senior unsecured notes issued by Cielo and the backed senior unsecured notes issued by Cielo USA Inc. All outlooks remained stable."
2020-06-16 17:45:09 -0400,Facebook Gains But Lags Market: What You Should Know,"Facebook (FB) closed at $235.65 in the latest trading session, marking a +1.35% move from the prior day."
2020-06-16 14:04:15 -0400,Facebook Officially Enters the Global Payment Industry,The social media giant launched WhatsApp Pay in Brazil Continue reading...
2020-06-16 12:00:00 -0400,Facebook Just Took a Huge Step Toward Monetizing WhatsApp,"Facebook's (NASDAQ: FB) efforts to monetize WhatsApp -- the messaging app it paid $19 billion for in 2014 -- have been delayed and rethought several times over by CEO Mark Zuckerberg and his management team.  Plans to place advertisements in WhatsApp Status were suspended earlier this year and efforts to launch a payments platform in India have hit a roadblock.  The service is built on Facebook Pay, which the company plans to use as the foundation to support payments across all of its apps."
2020-06-16 09:58:01 -0400,Facebook Launches WhatsApp Digital Payment in Brazil,"Facebook (FB) launches WhatsApp Pay in Brazil to encourage e-commerce on its platform, intensifying competition for MELI and PAGS."
2020-06-16 08:34:00 -0400,Think it’s too late to buy big tech stocks? Here’s an overlooked comeback play with a 5% dividend,IBM will provide you with a large income stream as it makes moves to return to growth under a new CEO.
2020-06-16 03:52:13 -0400,Facebook’s WhatsApp Rolls Out Digital Payment Service In Brazil,"Facebook Inc.’s (FB) WhatsApp has launched a payment service across Brazil to allow users to send money securely to individuals or make a purchase from a local business without leaving their chat.With the digital payment service tool, the social media giant seeks to attract over 10 million of Brazil’s small and micro businesses into the digital economy and open up new opportunities for growth.The payments feature on WhatsApp is run via Facebook Pay and processed by Cielo in Brazil. Shares in the Brazilian payments processor on Monday jumped 20% to $0.98 in U.S. trading. In the future, Facebook wants to make it possible for people and businesses to use the same card information across Facebook’s family of apps.For individuals, the payment ..."
2020-06-16 00:15:59 -0400,Facebook launches WhatsApp digital payment service,"WhatsApp Pay's introduction in Brazil comes ahead of expected launches in India, Indonesia and Mexico."
2020-06-15 21:33:16 -0400,How Does ClassPass Make Money?,"With its digital platform for fitness classes, ClassPass has taken consumer wellness by storm, and it's about to do the same in corporate wellness."
2020-06-15 19:50:00 -0400,Tim Cook and other tech CEOs praise Supreme Court ruling protecting LGBTQ workers,The CEOs of some of America’s biggest tech companies praised the U.S. Supreme Court’s ruling Monday protecting LGBTQ workers from job discrimination.
2020-06-15 19:00:00 -0400,World's Largest Hedge Fund Goes All In On This $30 Trillion Mega-Trend,The new king of Wall Street recognized and bought into the sustainable investing ethos long ago and is now looking to take its sustainable portfolio from $90 billion to more than a trillion dollars
2020-06-15 10:58:26 -0400,House asks big tech CEOS to testify in competition probe,"The House is asking CEOs of big tech companies, including Facebook, Google, Amazon and Apple, to testify in a competition probe. Yahoo Finance's Tech Editor Dan Howley joins The First Trade to discuss."
2020-06-15 06:06:00 -0400,Have $500? Here Are the Best Stocks to Buy During a Correction,"Panic and uncertainty tied to the coronavirus disease 2019 (COVID-19) pandemic initially pushed the broad-based S&P 500 into bear market territory in just 17 trading sessions.  As recently as last week, the S&P 500 had bounced more than 40% from its lows and appeared to have established a new bull market.  Historically speaking, a correction or crash following a major bounce from a bear market bottom is perfectly normal and expected."
2020-06-12 18:02:15 -0400,Facebook fires employee who protested its inaction on Trump tweets,"A Facebook Inc employee who criticized Chief Executive Mark Zuckerberg's decision not to take action against inflammatory posts by U.S. President Donald Trump this month said on Friday that the social media company had fired him.  Brandon Dail, whose social media profiles describe him as a user interface engineer in Seattle, wrote on Twitter that he was dismissed for publicly challenging a colleague's silence on the controversy that prompted a rare staff protest at Facebook.  Dozens of employees, including Dail, abandoned their desks and tweeted objections to Zuckerberg's handling of Trump's posts."
2020-06-12 15:58:00 -0400,"The new tech hubs: With more employees working from home, companies could diversify workforces","A confluence of factors tied to COVID-19, the thriving work-from-home economy, and social protests could be accelerating momentum in Atlanta and other destinations far from Silicon Valley. The events have put a spotlight squarely on the hiring patterns of U.S. corporations during a slice of time when the physical location of prospective employees isn’t crucial, and when most organizations are actively supporting social causes with donations, pledges of support, and vows to do more on diversity and inclusion."
2020-06-12 14:31:57 -0400,Big tech under scrutiny for lack of minority hiring: RPT,"Snap CEO Spiegel recently said the company won’t release diversity numbers publicly, while Apple and and Youtube each plan $100 million initiatives to target racism. Yahoo Finance’s Brian Cheung joins Akiko Fujita to discuss."
2020-06-12 13:02:40 -0400,"Retail investors flock to tech, will it last?",Tech giants lost more than $269 billion in value on Thursday amid the market selloff. Albion Financial Group Partner & CIO Jason Ware joins Yahoo Finance’s On The Move panel to weigh in.
2020-06-12 11:30:25 -0400,Facebook's Giphy Deal Getting a Once-Over by UK Regulators,UK's Competition and Markets Authority wants Facebook and Giphy to stop integrating until it finishes its inquiry.
2020-06-12 11:10:35 -0400,Facebook's Giphy purchase facing UK investigation,"Facebook is facing a new investigation over its planned purchase of Giphy. Yahoo Finance's Brian Sozzi, Alexis Christoforous, and Dan Howley discuss."
2020-06-12 10:37:02 -0400,"The Zacks Analyst Blog Highlights: Facebook, Adobe Systems, BP, Boeing and Sony","The Zacks Analyst Blog Highlights: Facebook, Adobe Systems, BP, Boeing and Sony"
2020-06-12 08:19:09 -0400,Facebook's Giphy deal draws UK competition watchdog's attention,"The parent of messaging app WhatsApp bought Giphy, a popular website for making and sharing animated images, or GIFs, in May to integrate it with its rapidly growing photo-sharing app, Instagram.  While a formal probe is yet to begin, the Competition and Markets Authority (CMA) earlier this week served Facebook with an initial enforcement order and on Friday began the first stage of an investigation, inviting comments on the transaction from any interested party.  Facebook, the world's largest social media network, did not immediately respond to a Reuters request for comment."
2020-06-11 23:25:21 -0400,Palantir to File IPO in Weeks For Possible Fall Debut,"(Bloomberg) -- Palantir Technologies Inc., the secretive big-data firm, plans to file to go public in the coming weeks and could start trading as early as the fall, according to people familiar with the matter.The Palo Alto, California-based company is preparing to register an S-1 filing confidentially with the U.S. Securities and Exchange Commission, said the people, who asked to not be identified because the matter isn’t public.Palantir is working with bankers to organize a tender offer for private shareholders to help clean up its capital structure ahead of an initial public offering, the people said. It’s also working with an IPO readiness consultant, they said.Private investors last valued Palantir at $20 billion in 2015. It isn’t cl..."
2020-06-11 23:09:04 -0400,"Google's new rules clamp down on discriminatory housing, job ads","Alphabet Inc's Google said on Thursday it was tackling unlawful discrimination by barring housing, employment and credit ads from being targeted to its users based on their postal code, gender, age, parental status or marital status.  The new policy, which will take effect by the end of the year in the United States and Canada, comes more than a year after the U.S. Department of Housing and Urban Development (HUD) charged Facebook Inc for selling discriminatory housing ads and said it was looking into similar concerns about Google and Twitter Inc."
2020-06-11 18:31:19 -0400,Biden calls on Facebook to get tougher on misinformation ahead of the election,"Joe Biden’s presidential campaign is targeting Facebook, calling on the tech giant to fix several of its policies ahead of the 2020 election. Yahoo Finance's Rick Newman joins The Final Round to discuss this as well as Yahoo Finance's interview with Peter Navarro, the White House Director of Trade and Manufacturing Policy."
2020-06-11 17:58:55 -0400,Chris Cox Returns as Facebook Product Chief a Year After Disagreement With Zuckerberg,"It's all water under the bridge, apparently: Chris Cox is coming back to Facebook as chief product officer, after his sudden departure in March 2019 over an apparent dispute with his boss, CEO Mark Zuckerberg. Cox, in announcing his return to Facebook in a post Thursday on the social network, said ""it’s a different world […]"
2020-06-11 15:10:00 -0400,Facebook's former chief product officer is returning to fold; diversity head's role expanded,"As several disgruntled Facebook Inc.  employees quit in protest of the company's handling of incendiary posts from President Donald Trump, a familiar face is returning to the fold and another is being promoted. Chris Cox announced in a Facebook post Thursday that he is returning as chief product officer after leaving a year ago because of a dispute over end-to-end encryption. ""I've been encouraged by progress on so many of the big issues facing us,"" Cox wrote. ""Our most important decisions and products are ahead of us."" At the same time, Facebook Chief Operating Officer Sheryl Sandberg, in a separate post, announced other executive changes. ""Last week [Chief Executive] Mark [Zuckerberg] laid out seven areas that Facebook would be reviewin..."
2020-06-11 13:03:21 -0400,Facebook to start new venture arm,Axios is reporting that Facebook is establishing a venture arm to invest in startups. Yahoo Finance's Dan Howley joins the On the Move panel to break down the details
2020-06-11 13:00:25 -0400,U.S. Democratic candidate Biden calls for Facebook to fact-check politicians' ads,"""There should be a two-week pre-election period during which all political advertisements must be fact-checked before they are permitted to run on Facebook,"" the letter said.  The Biden campaign's move adds to pressure faced by Facebook to alter its policies around political ads and speech.  Zuckerberg last week promised a review of its content policies after the company faced backlash over taking no action on a post  by Republican President Donald Trump that were labeled by Twitter Inc for violating the smaller rival's rules."
2020-06-11 12:40:54 -0400,"Biden Takes On Facebook, Saying It Failed to Stop Disinformation","(Bloomberg) -- Joe Biden lashed out at Facebook Inc on Thursday, saying the social media company has failed to stop the spread of disinformation and circulating an open letter for supporters to demand the company change its policies.“With fewer than five months until the 2020 election, real changes to Facebook’s policies for their platform and how they enforce them are necessary to protect against a repeat of the role that disinformation played in the 2016 election and that continues to threaten our democracy today. We are urging our supporters to make their voices heard in this call for change,” Bill Russo, a campaign spokesman, said in a statement.The Biden campaign says the Democrat wants Facebook to promote trustworthy sources of info..."
2020-06-11 09:40:00 -0400,Facebook Is Essential for Small Businesses,"Many small businesses were hit exceptionally hard by the coronavirus pandemic.  While the pandemic curbed consumer spending, many small businesses struggled to adapt their businesses to online ordering.  Facebook (NASDAQ: FB) may be an essential piece of operations for small businesses desperate for traffic."
2020-06-11 07:15:00 -0400,4 Stocks To Buy To Invest in Virtual Reality,"The virtual reality market has been hailed as the ""next big thing"" for decades, but VR has repeatedly disappointed consumers with mediocre hardware products and software experiences.  The VR market's future has yet to be written, but investors who believe in this budding market should consider buying these four tech stocks.  The PSVR will be fully compatible with the upcoming PS5, and could differentiate the next-gen console from Microsoft's (NASDAQ: MSFT) Xbox Series X. Microsoft has already said it won't prioritize VR experiences for its new console, so the PSVR could dazzle more gamers when paired with the PS5's more powerful hardware."
2020-06-11 06:38:03 -0400,Facebook says no proof of malicious acts by fake accounts in Philippines,"Facebook has yet to find evidence that user-reported accounts that proliferated in the Philippines at the weekend had engaged in malicious and coordinated acts, the world's biggest social network said on Thursday.  A deluge of impostor accounts using the identities of students, journalists and government officials alarmed social media users and prompted an investigation by government agencies.  ""At this time, we have not seen evidence of the reported accounts engaging in coordinated or malicious activity focused on creating fake accounts,"" Facebook said in a statement."
2020-06-10 17:27:19 -0400,These companies are neither media companies nor neutral platforms: NYU Professor on social media,"As protests continue to spread around the world, social media companies continue to come under fire for moderation of content. Deputy Director of NYU Stern Center for Business and Human Rights Professor Paul Barrett joins to discuss big tech's response."
2020-06-10 13:07:49 -0400,EU lawmakers call on big tech to tackle coronavirus misinformation,"EU officials want tech giants Google, Facebook, and Twitter to report monthly audits regarding coronavirus misinformation. Yahoo Finance’s On The Move panel discusses."
2020-06-10 12:25:07 -0400,"Facebook Should Face Liability Over Ads, Top House Democrat Says","(Bloomberg) -- U.S. lawmakers should look into increasing liability for online platforms such as Facebook Inc. for ads and other commercial speech, a top House Democrat said on Wednesday.The comments by Representative Jan Schakowsky, chairwoman of a subcommittee on consumer protection that has also taken the lead in shaping an online privacy bill, come as a legal shield protecting the companies from lawsuits over third-party content is under increasing attack from both parties in Washington.Advocates of the legal immunity, known as Section 230 of the Communications Decency Act, have argued that it protects free speech online by encouraging social media platforms to leave up controversial content, although it also protects their efforts to..."
2020-06-10 12:21:06 -0400,Social Chain CEO: Brands need to bring change that lasts ‘longer than a trending topic’,The CEO of Social Chain says brands need to treat calls for racial equality as more than a passing fad.
2020-06-10 07:38:39 -0400,U.S. companies vow to fight racism but face critics on diversity,"Many social justice advocates, corporate diversity experts and investors say companies also need to focus on equity in their own ranks, especially by hiring and promoting minority workers.  The tensions show the difficulty executives face in aligning their firms with popular social causes at a time of soaring wealth and inequality – and growing pressure from some investors to show leadership on societal problems.  Activists, along with some business leaders, also see an opportunity amid global protests to push reform on social justice issues well beyond police brutality."
2020-06-09 19:36:09 -0400,South Korea Jobless Rate Jumps to 10-year High Amid Pandemic,"(Bloomberg) -- South Korea’s jobless rate jumped to a 10-year high in May as the coronavirus pandemic continued to take a toll on the country’s trade-dependent economy.The unemployment rate climbed to 4.5% last month, from 3.8% in April, data from the statistics office showed Wednesday. Economists expected a rise to 4%. The number of jobs fell by 392,000 in May from the prior year.“The jobs situation is difficult to predict going forward,” South Korean Finance Minister Hong Nam-ki wrote on Facebook following the unemployment report. “Economic contractions in trading partners are leading to falling exports and that is negatively affecting employment in manufacturing.”South Korea’s businesses are slashing hiring to cut costs as exports cont..."
2020-06-09 19:01:00 -0400,Jim Cramer: Stocks to Buy If You're Feeling Better About the Economy's Descent,"You buy stocks of secular growers, the ones that have particular engines developed by themselves that allow them to fly into headwinds without a problem."
2020-06-09 18:26:48 -0400,Trump Turns to Favored Cable Network to Prop Up Antifa Claims,"(Bloomberg) -- President Donald Trump tweeted early Tuesday morning that a 75-year-old protester who was seriously injured by Buffalo police officers “could be an ANTIFA provocateur.”The baseless claim set off the latest chapter in a rolling controversy over the president’s social media activity, highlighting how fringe ideas make their way from the far reaches of the internet to mainstream consciousness. In this case, a key step was One America News Network, a conservative TV station that increasingly has Trump’s ear.Videos spread last week of two police officers pushing over a man named Martin Gugino without provocation; Gugino fell and began bleeding from his head. The officers were later arrested, and charged with assault. The case ha..."
2020-06-09 18:17:15 -0400,Stock market news live updates: Stock futures drift higher ahead of Fed meeting,"Stock futures kicked off the overnight session slightly higher, edging up slightly as market participants awaited the Federal Reserve’s latest monetary policy decision and commentary Wednesday."
2020-06-09 17:47:32 -0400,Facebook Launches Messenger Business Inbox,Now Facebook Messenger can handle both business and personal chats.
2020-06-09 14:33:00 -0400,Facebook Nears New High as Goldman Raises Price Target on E-Commerce Potential,"Analyst Heather Bellini maintains a Buy rating on Facebook stock, while lifting her price target to $250 from $220."
2020-06-09 14:04:41 -0400,Why Twitter won’t do anything about Trump’s conspiratorial Buffalo protester tweet,"In the hours after President Trump baselessly made a series of claims about the injured Buffalo protestor, Twitter CEO Jack Dorsey’s mentions have been flooded with calls for action."
