datetime,title,content
2020-07-16 13:32:57 -0400,Why Dell Stock Soared Today,"What happened Shares of Dell (NYSE: DELL) have soared today, up by 14% as of 12:10 p.m. EDT, after the company announced yesterday evening that it was exploring the idea of selling its majority stake in virtualization specialist VMWare (NYSE: VMW)."
2020-07-16 05:23:30 -0400,Dell Mulls Sale Of 81% Stake In VMware Pushing Shares Higher In Pre-Market,"Shares in Dell Technologies (DELL) surged 7% in pre-market trading as the PC maker said that it is considering a spin-off of its 81% stake in cloud computing software maker VMware Inc. (VMW), which could unlock value for shareholders.The stock soared to $56.40, while VMware rose 1.9% to $142.40 in Thursday’s early market trading. Dell said that a divestment could benefit both Dell and VMware shareholders by simplifying capital structures and creating additional long-term enterprise value. A potential spin-off is not expected to occur before Sept. 2021 and would qualify to become tax-free for U.S. tax purposes.If the PC maker decides to pursue a spin-off, it would set up a special committee to negotiate mutually beneficial commercial arran..."
2020-07-15 19:47:30 -0400,Dell Says It’s Exploring Potential Spinoff of VMware Unit,"(Bloomberg) -- Dell Technologies Inc. said it’s in the early stages of exploring a spinoff of its majority ownership in VMware Inc., a deal that could yield billions, but would separate the hardware giant from its fastest-growing business unit.Dell’s shares gained about 7% in extended trading after closing at $52.68 in New York. VMware stock, which closed at $139.70 gained more than 2%.A spinoff “could benefit both Dell Technologies and VMware shareholders,” Round Rock, Texas-based Dell said Wednesday in a statement. Any deal wouldn’t happen before September 2021 at the earliest, for a tax-free transaction, the company said. Dell said it may decide to maintain its current 81% ownership of VMware or pursue another strategic option.Chief Ex..."
2020-07-15 19:20:00 -0400,This Is What Will Happen if Dell Spins Off Its Stake in VMware,"(DELL) Technologies late Wednesday confirmed recent reports that it is considering spinning off its 81% stake in  (VMW) shares to current Dell holders, in a deal that also could include VMware paying a substantial special dividend to Dell and other holders.  Dell (ticker: DELL) said in a filing with the SEC that a VMware (VMW) spinoff “could benefit both Dell Technologies’ and VMware’s stockholders by simplifying capital structures and enhancing strategic flexibility, while still maintaining a mutually beneficial strategic and commercial partnership.”  Dell said it could also decide to maintain the status quo."
2020-07-15 17:05:00 -0400,"Dell 'exploring' VMWare stake spinoff, Dell stock rallies 8%","Dell Technologies Inc.  is &quot;exploring&quot; a potential spin-off of its 81% stake in VMWare Inc.  no sooner than next year, Dell said late Wednesday. The &quot;exploration is in an early stage,&quot; and a spinoff would benefit both Dell Technologies and VMware stakeholders &quot;by simplifying capital structures and creating additional long-term enterprise value,&quot; Dell said. Any potential spin-off would not happen before September 2021 and Dell continues to weigh its options, including keeping its current ownership in VMWare as is, Dell said. After the announcement, shares of Dell jumped nearly 8% in the extended session, while VMWare shares rose 3.7%. The stocks had ended the regular trading day up 0.3% and 1.1%, respectively."
2020-07-15 17:03:15 -0400,Dell considering potential spin-off of VMware stake,"July 15 (Reuters) - Dell Technologies Inc is exploring a potential spin-off of its majority stake in VMware , the PC maker said on Wednesday."
2020-07-15 16:50:00 -0400,Dell Technologies Explores VMware Spin-Off,Dell Technologies is exploring a potential spin-off of its 81% ownership of VMware. Potential deal could unlock value for shareholders
2020-07-15 11:48:00 -0400,VMware Appears Headed Upward,"Jim Cramer during ""Mad Money"" on Tuesday evening answered a caller who asked about VMware Inc.  in the show's ""Lightning Round"" segment.  ""I think many good things are happening and you should buy more stock,"" said Cramer.  In this daily bar chart of VMW, below, we can see that prices have traded sideways since early June."
2020-07-15 08:00:00 -0400,"VMware Cloud on AWS Delivers on Customer Requirements for Agility, Business Continuity, and Better Cloud Economics","VMware, Inc. (NYSE: VMW) today announced new capabilities designed to further improve the economic value of VMware Cloud on AWS while meeting an evolving set of requirements for application modernization, business continuity and resiliency, and cloud migration. These new offerings include the new Amazon Elastic Compute Cloud (Amazon EC2) i3en instances that can deliver nearly 50% lower cost per GB of raw storage, a 2-host SDDC configuration that lowers the entry price for production environments by 33%, and a new multi-tenant cloud management service that enables partners to support 5-10x more customers with no additional upfront costs, while enabling smaller organizations to purchase VMware Cloud on AWS on a per VM rather than per host b..."
2020-07-14 08:00:00 -0400,"VMworld 2020 Goes Digital: Immersive Experience Offers Best Practices Sharing From Leading Companies, Personalized Learning, Business Consultations, Networking and Hands-on Training Opportunities","VMware, Inc. (NYSE: VMW), a leading innovator in enterprise software, today opened the content catalog for its first-ever completely digital VMworld, which will be held from September 29 to October 1, 2020. Most of the VMworld 2020 content is free to attendees."
2020-07-14 05:00:00 -0400,VMware Releases Cybersecurity Threat Survey Report Detailing Increased Attack Volume and Breach Levels in the United States,"VMware, Inc. (NYSE: VMW), a leading innovator in enterprise software, today released the results of its first U.S.-focused cybersecurity threat report, entitled: &quot;Extended Enterprise Under Threat,&quot; based on a survey of 250 U.S. CIOs, CTOs and CISOs."
2020-07-12 20:52:51 -0400,"Did Hedge Funds Make The Right Call On VMware, Inc. ?",Insider Monkey has processed numerous 13F filings of hedge funds and successful value investors to create an extensive database of hedge fund holdings. The 13F filings show the hedge funds' and successful investors' positions as of the end of the first quarter. You can find articles about an individual hedge fund's trades on numerous financial […]
2020-07-07 15:01:00 -0400,"Stand-Alone Dell Worth 30% More Than Current Price Implies, Analyst Says",Dell Technologies is considering strategic options for its 81% stake in VMware. Deutsche Bank’s Jeriel Ong thinks it could be worth 20%-30% more than its current share price.
2020-07-07 11:13:03 -0400,CenturyLink Ups Cloud Solutions With Tripartite Partnership,CenturyLink (CTL) extends its tripartite alliance with VMware and Dell to support businesses based in the Asia Pacific region with avant-garde hybrid cloud solutions.
2020-07-06 02:00:00 -0400,VMware Fast Tracks Transformation of Partner Ecosystem across Southeast Asia and Korea for Region's Increasingly Digital Future,"VMware, Inc. (NYSE: VMW), a leading innovator in enterprise software, affirmed its pledge to strengthen the partner ecosystem across the Southeast Asia and Korea (SEAK) region following the successful launch of EMPOWER Online APJ, along a series of Partner Executive Briefings, which saw the participation of more than 1,200 attendees in VMware's partner ecosystem in Asia Pacific and Japan. During the events, VMware and its partners came together for a deep dive into how the community can further spur digital transformation and agility for businesses to adapt to the region's increasingly mobile-first business environment."
2020-07-01 08:00:00 -0400,VMware Extends No. 1 Ranking in Cloud System and Service Management According to Global Analyst Firm,"VMware, Inc. (NYSE: VMW), a leading innovator in enterprise software, today announced that leading analyst firm IDC has ranked VMware No. 1 in worldwide cloud system and service management software(1) based on IDC calculations of calendar year 2019 revenues. VMware’s continued commitment to helping customers operate their hybrid cloud and multi-cloud environments is enabling them to achieve higher levels of productivity, cost savings and compliance."
2020-06-30 17:04:00 -0400,"Shareholder Alert: Robbins LLP Is Investigating the Officers and Directors of VMware, Inc. ","Shareholder rights law firm Robbins LLP announces that it is investigating the officers and directors of VMware, Inc. (NYSE: VMW) for breaches of fiduciary duties, unjust enrichment, waste of corporate assets, and violations of the Securities Exchange Act of 1934. VMware provides software in the areas of hybrid cloud, multi-cloud, modern applications, networking and security, and digital workspaces."
2020-06-30 11:48:00 -0400,"Dell and HP Likely to See PC Sales Slow in Second Half, Analyst Says","The personal computer business is not an easy place to make money.  Dell, meanwhile, is reportedly discussing various options for its 81% stake in  (VMW) (VMW), which could include selling or distributing the position—or buying out the public holders.  Cowen analyst Krish Sankar picked up coverage of both Dell and HP on Tuesday—and he is wary of both stocks."
2020-06-30 08:00:00 -0400,"Modern Applications Are Helping Organizations Succeed During Pandemic, VMware Research Reveals","According to new research by VMware, Inc. (NYSE: VMW), organizations have benefitted from the use of modern applications to adapt and maintain agility and reliability during the COVID-19 pandemic. The global study, which was conducted in March and April 2020, also reveals improved perceptions of alignment across app developers, IT and business decision makers as they collaborate to help their organizations operate amid the pandemic. Additionally, it captures the traits that the most successful organizations are adopting to better their digital experiences."
2020-06-29 13:43:00 -0400,Dell’s 7 Strategic Options for Its VMware Stake,"Last week, The Wall Street Journal reported that Dell (ticker: DELL) was weighing various options for the stake, including a potential spinoff to current Dell holders.  As of Monday morning, Dell has a market value of $39.6 billion; the company’s stake in VMware (VMW) is worth $50.7 billion.  Dell has about $40 billion in debt, excluding its equipment finance unit, mostly from its 2016 acquisition of EMC."
2020-06-27 11:30:03 -0400,VMware Up 2.9% Since Last Earnings Report: Can It Continue?,VMware (VMW) reported earnings 30 days ago. What's next for the stock? We take a look at earnings estimates for some clues.
2020-06-26 17:45:00 -0400,How Dell Stock Can Take Off. A VMware Spinoff Is Just Part of the Answer.,A more bullish option for the computer hardware giant would be to convert supervoting shares into regular stock
2020-06-26 06:30:00 -0400,[video]How Dell's Situation with VMware Resembles eBay's Former Situation with PayPal,"Like eBay's spinoff of PayPal, a Dell spinoff of VMware could both unlock shareholder value and strategically benefit the spun-off company."
2020-06-25 17:52:24 -0400,2 ‘Perfect 10’ Stocks to Ride the Post-Covid-19 Wave,"Since February, markets have been taking us for a roller coaster ride. Since the bottom fell out, sending the S&P index plunging 34% in the steepest bear market on record, volatility has ruled the day. Coronavirus fears spurred the drop, as investors watched economies sputter to a halt during the prolonged lockdown policies.Since then, markets have stabilized. Financial experts originally believed that the S&P would find resistance levels in the 2,750 to 2,850 range – but the rebound carried the index higher. Through the month of June, despite some notable ups and downs, the S&P has stayed in the 3,000 to 3,200 range. It appears to be a solid consolidation, giving investors reason for a positive outlook.So, where does the market go from h..."
2020-06-25 13:03:13 -0400,Cloud computing ETFs soar sky high,Yahoo Finance’s Akiko Fujita and director for global ETF research Ben Johnson discuss the moves in cloud computing ETFs amid COVID-19.
2020-06-24 16:35:47 -0400,"US STOCKS-Wall Street finishes lower on rising virus cases, weak economic view","Wall Street's three major indexes on Wednesday suffered their biggest daily percentage drop in almost two weeks as a surge in U.S. coronavirus cases intensified fears of another round of government lockdowns and worsening economic damage.  Nasdaq, which had registered its fifth record closing high on Tuesday, snapped an eight-day wining streak, which was its longest since December 2019.  The session marked the biggest percentage decline for all three indexes, including a 2.6% drop for the S&P 500, since June 11 when the S&P fell 5.89%."
2020-06-24 14:18:42 -0400,"US STOCKS-Wall Street drops on rising virus cases, weak economic view","U.S. stocks fell sharply on Wednesday as a surge in coronavirus cases in the United States re-ignited fears of a new round of  government lockdowns, compounding worsening forecasts of the economic damage from the pandemic further.  The United States has recorded the second-largest rise in infections since the health crisis began, with states where restrictions meant to slow the spread of the disease were lifted early witnessing a flare-up in cases.  Shares of U.S. airlines, resorts and cruise operators slumped."
2020-06-24 13:35:00 -0400,"Dell, VMware stocks rally as resolution to ownership ‘soap opera’ gets a new teaser trailer",Shares of Dell Technologies Inc. and VMware Inc. stand out like tiny green islands in a sea of red Wednesday as analysts chime in on the seemingly neverending ownership “soap opera” between the two companies following a report that a strategic shakeup was in the works.
2020-06-24 13:06:42 -0400,"US STOCKS-Wall Street tumbles on rising virus cases, grim economic forecast","U.S. stocks fell sharply on Wednesday as a surge in coronavirus cases in the United States fanned fears of a fresh lockdown, with worsening forecasts of the economic damage from the pandemic further denting sentiment.  The United States has recorded the second-largest rise in infections since the health crisis began, with states where restrictions meant to slow the spread of the disease were lifted early witnessing a flare up in cases.  Shares of U.S. airlines, resorts and cruise operators slumped and the S&P 1500 airlines index fell 7.3%."
2020-06-24 11:22:05 -0400,"US STOCKS-Wall Street slumps on virus worries, grim economic forecast","Wall Street's three major indexes tumbled on Wednesday as investors weighed the risk to domestic economy from rising coronavirus cases and a worsening forecast of the damage from the pandemic.  The International Monetary Fund said the pandemic was causing wider and deeper damage to economic activity than first thought, prompting it to slash its 2020 global output forecasts further to 4.9% from 3.0%.  Wall Street's fear gauge, the CBOE volatility index, rose 3.4 points to 34.74."
2020-06-24 11:10:58 -0400,"Apple acquires startup aimed at managing corporate Macs, iPads","June 24 (Reuters) - Apple Inc has acquired Fleetsmith, a San Francisco-based startup company whose technology helps businesses manage Apple's Mac and iPad devices among their employee bases."
2020-06-24 10:40:09 -0400,"US STOCKS-Wall Street slides on virus worries, grim economic forecast","Wall Street's major indexes fell on Wednesday as investors weighed the risk to domestic economy from rising coronavirus cases and a worsening forecast of the damage from the pandemic.  The International Monetary Fund said the pandemic was causing wider and deeper damage to economic activity than first thought, and it slashed forecast for a contraction in global output to 4.9% from 3.0%.  ""The rising number of coronavirus cases we're continuing to see in the United States is a major concern despite the Trump administration's previous refusal to lockdown the economy again,"" said Craig Erlam, market analyst at OANDA in London."
2020-06-24 09:46:01 -0400,Dell VMware Spinoff Debated by Street as Real or ‘Head Fake’,"(Bloomberg) -- Dell Technologies Inc. surged as much as 12% touching a seven-month high on Wednesday following a report that the computer maker was mulling a spinoff of its stake in VMware Inc.While Dell is also said to be considering buying the rest of the company or doing nothing, a spinoff of its 81% stake could finally eliminate a VMware “albatross” that has been causing the stock to trade at a discount, Wedbush analyst Daniel Ives wrote. But it’s unclear if this is “another head fake for investors.”Analysts at Citi saw a spinoff as speeding up the pace of deleveraging. But it isn’t seen as a necessary step since Dell is on a path to reach investment grade status in the next 18-24 months.Morgan Stanley analysts see Dell and VMware as ..."
2020-06-24 09:18:58 -0400,"Dell, VMware Spike In Pre-Market On Report Dell Is Mulling Spinoff Of $50B Stake","Shares in Dell Technologies (DELL) spiked 14% in pre-market trading on a report that the PC maker is mulling a spinoff of its roughly $50 billion stake in cloud computing software maker VMware Inc. (VMW)The stock surged to $55.90 in pre-market trading. Meanwhile, VMware shares rose 8.8% to $162.39.Dell is exploring the possibility of divesting the stake or taking other steps that could include buying the rest of the cloud-software giant, the Wall Street Journal reported. The companies are working with outside advisers on a number of scenarios.However, the report also stated that the evaluation deliberations are at an early stage and that no decision is imminent adding that any move is &quot;unlikely&quot; before 2021.Dell’s 81% stake in V..."
2020-06-24 08:15:32 -0400,"Dow Jones Today, Futures Slip As Coronavirus, Euro Tariffs Weigh; VMware Poised For Breakout","Nvidia rose, and VMware set up for a breakout Wednesday as stock futures slumped on coronavirus and trade concerns."
2020-06-24 08:00:00 -0400,VMware Expands Its VMware Ready for Telco Cloud Program to Accelerate the Deployment of 5G Services on Its Telco Cloud Platform,"VMware, Inc. (NYSE: VMW) today announced it has expanded its award-winning VMware Ready for Telco Cloud program, formerly known as the VMware Ready for NFV program. The enhanced certification program will enable telco network functions partners to test the interoperability and readiness of their Virtual Network Functions (VNF) and Cloud-Native Network Functions (CNF) with the VMware Telco Cloud platform."
2020-06-24 06:58:00 -0400,Why gold may continue to rally — as long as U.S. stocks do,"What’s driving gold is the fall in inflation-adjusted bond yields — and that should continue as long as the stock market rally holds up, says one researcher."
2020-06-24 01:43:47 -0400,PRESS DIGEST - Wall Street Journal - June 24,June 24 (Reuters) - The following are the top stories in the Wall Street Journal on Wednesday. Reuters has not verified these stories and does not vouch for their accuracy.
2020-06-23 18:56:27 -0400,Dell Plots $50 BIllion More of Financial Finessing,"(Bloomberg Opinion) -- Dell Technologies Inc.’s magical merry-go-round of financial engineering is spinning once again.The corporate computing giant is examining options for its majority stake in software-company VMware Inc. that include a spinoff of the holdings, the Wall Street Journal reported late Tuesday. VMware shares soared roughly 10% on the news in after-market trading, valuing Dell’s 81% stake at around $55 billion. To understand why Dell would contemplate a transaction like this, you only have to look at Dell’s own market value, which despite a rise of its own on the news of the possible spinoff amounted to only about $40 billion. Put another way, Dell isn’t getting full value for either its ownership of VMware or its own compu..."
2020-06-23 17:43:00 -0400,Dell Stock Soars on Report It Is Weighing Spinoff of VMware Stake,The Wall Street Journal reported that the company has hired advisors to consider options for the company’s 81% stake in the enterprise-software company VMware.
2020-06-23 16:31:57 -0400,Dell considering spinning off VMware stake: WSJ,"(Reuters) - Dell Technologies Inc <DELL.N> is considering spinning off its roughly $50 billion stake in cloud computing software maker VMware Inc <VMW.N>, the Wall Street Journal reported on Tuesday."
2020-06-23 16:26:00 -0400,"Dell, VMware stocks surge on report of plans for strategic shakeup","Shares of Dell Technologies Inc.  and VWware Inc.  rallied in the extended session Tuesday following a report that Dell was considering options for its considerable stake in VMware. Dell shares rallied 15%, following a 1.5% rise to close at $49.01, while VMware shares surged 8%, following a 0.8% gain to close at $149.23. Late Tuesday, The Wall Street Journal reported  that Dell was exploring options for its 81% stake in VMware, including unloading the stake or buying the company outright, according to unnamed sources close to the matter. The Journal said, however, that the review is at an early stage and that no decision is imminent."
2020-06-22 10:05:00 -0400,Remain Long VMware as it Could Move Higher Still,"For his second ""Executive Decision"" segment of Mad Money Thursday night, Jim Cramer spoke with Sanjay Poonen, COO of VMware  , the cloud software provider.  Poonen touted VMware's Tanzu mission control software as the perfect solution for companies looking to manage applications across multiple clouds.  In this updated daily bar chart of VMW, below, we can see that prices did not decline to our suggested stop close order below $130."
2020-06-19 16:15:00 -0400,VMware to Present at the Morgan Stanley ‘Zero Trust Architectures’ Virtual Thematic Conference,"VMware, Inc. (NYSE: VMW), a leading innovator in enterprise software, today announced that Patrick Morley, VMware’s senior vice president and general manager, security business unit will present at the Morgan Stanley ‘Zero Trust Architectures’ Virtual Conference on Thursday, June 25, 2020 at 9:00 a.m. PT/ 12:00 p.m. ET."
2020-06-17 20:32:45 -0400,Edited Transcript of VMW.N earnings conference call or presentation 28-May-20 8:30pm GMT,Q1 2021 VMware Inc Earnings Call
2020-06-09 13:51:05 -0400,5 Guru Stocks Predicted to Boost Earnings,Alibaba makes the list Continue reading...
2020-06-02 16:15:00 -0400,VMware to Present at the William Blair 40th Annual Growth Stock Virtual Conference,"VMware, Inc. (NYSE: VMW), a leading innovator in enterprise software, today announced that Rajiv Ramaswami, VMware’s chief operating officer, products and cloud services will present at the William Blair 40th Annual Growth Stock Virtual Conference on Wednesday, June 10, 2020 at 10:00 a.m. PT/ 1:00 p.m. ET."
2020-06-02 13:28:00 -0400,"CURRENT SHAREHOLDERS: Zamansky LLC Investigates VMware, Inc. for Potential Breaches of Fiduciary Duties","Zamansky LLC announces that it is investigating VMware, Inc. (VMW) (""VMware"" or the ""Company"") for potential breaches of fiduciary duties by VMware’s senior officers and board of directors. If you are a shareholder of VMware who still holds your shares, please contact our firm for information."
2020-06-02 08:00:00 -0400,VMware Introduces Delivery of Elastic Infrastructure for AI/ML Applications with VMware vSphere 7,"VMware, Inc. (NYSE: VMW) today introduced a new integrated feature in VMware vSphere 7 that will enable enterprises to deliver elastic infrastructure on-demand for artificial intelligence (AI) and machine learning (ML) applications. This new feature—VMware vSphere Bitfusion—is developed out of VMware’s 2019 acquisition of Bitfusion, a pioneer in the virtualization of hardware accelerator resources including graphics processing unit (GPU) technology."
2020-06-02 08:00:00 -0400,VMware Names Carol Carpenter Chief Marketing Officer,"VMware, Inc. (NYSE: VMW), a leading innovator in enterprise software, today announced that Carol Carpenter has joined the leadership team as chief marketing officer. As CMO, Carpenter is responsible for leading all aspects of the Global Marketing organization, which includes Corporate Marketing, Partner, Segment and Field Marketing."
2020-06-01 22:15:00 -0400,"VMware Brings Automation Cloud Service to Southeast Asia, Accelerating Growth of Region's Innovation Economy","VMware, Inc. (NYSE: VMW), a leading innovator in enterprise software, today announced the general availability of vRealize Automation Cloud Service in Singapore. Consisting of VMware Cloud Assembly, VMware Service Broker and VMware Code Stream, these services enable organizations to streamline application delivery, achieve cloud flexibility and choice while controlling costs – allowing them to fast-track business innovation as they pivot towards the region's mobile-first, app-driven economy."
2020-06-01 17:33:00 -0400,VMware Sees Composite Rating Improve To 97,"VMware saw its IBD SmartSelect Composite Rating jump to 97 Monday, up from 92 the day before. The revised score means the stock currently tops 97% of all other stocks in terms of key performance metrics and technical strength."
