datetime,title,content
2020-06-01 15:00:00 -0400,"VMW FINAL DEADLINE: Bronstein, Gewirtz & Grossman, LLC Reminds VMware, Inc. Shareholders With Losses Exceeding $100K of Class Action and Lead Plaintiff Deadline: June 1, 2020","New York, New York--(Newsfile Corp. - June 1, 2020) - Bronstein, Gewirtz & Grossman, LLC reminds investors that a class action lawsuit has been filed against VMware, Inc. (NYSE: VMW) (""VMware "" or ""the Company"") and certain of its officers, on behalf of shareholders who purchased or otherwise acquired VMware securities between March 30, 2019 and February 27, 2020, inclusive (the ""Class Period""). Such investors are encouraged to join this case by visiting the ..."
2020-06-01 10:31:23 -0400,"Earnings Beat: VMware, Inc. Just Beat Analyst Forecasts, And Analysts Have Been Updating Their Models","As you might know, VMware, Inc. (NYSE:VMW) just kicked off its latest first-quarter results with some very strong..."
2020-06-01 09:55:00 -0400,"DEADLINE TODAY: The Schall Law Firm Announces It Has Filed a Class Action Lawsuit Against VMware, Inc. and Encourages Investors with Losses in Excess of $100,000 to Contact the Firm","Los Angeles, California--(Newsfile Corp. - June 1, 2020) - The Schall Law Firm, a national shareholder rights litigation firm, announces the filing of a class action lawsuit against VMware, Inc. (NYSE: VMW) (""VMware"" or ""the Company"") for violations of §§10(b) and 20(a) of the Securities Exchange Act of 1934 and Rule 10b-5 promulgated thereunder by the U.S. Securities and Exchange Commission.Investors who purchased the Company's securities between March 30, 2019 and February 27, 2020, inclusive (the ..."
2020-06-01 08:33:00 -0400,"VMW ALERT: The Klein Law Firm Announces a Lead Plaintiff Deadline of June 1, 2020 in the Class Action Filed on Behalf of VMware, Inc. Limited Shareholders","New York, New York--(Newsfile Corp. - June 1, 2020) - The Klein Law Firm announces that a class action complaint has been filed on behalf of shareholders of VMware, Inc. (NYSE: VMW) alleging that the Company violated federal securities laws.Class Period: March 30, 2019 and February 27, 2020Lead Plaintiff Deadline: June 1, 2020Learn more about your recoverable losses in DNK:http://www.kleinstocklaw.com/pslra-1/vmware-inc-loss-submission-form?id=7029&from=5The filed complaint alleges that VMware, Inc. made materially false and/or misleading statements and/or failed ..."
2020-06-01 06:48:00 -0400,"SHAREHOLDER ALERT: Levi & Korsinsky, LLP Notifies Shareholders of VMware, Inc. of a Class Action Lawsuit and a Lead Plaintiff Deadline of June 1, 2020 - VMW","New York, New York--(Newsfile Corp. - June 1, 2020) - The following statement is being issued by Levi & Korsinsky, LLP:To: All persons or entities who purchased or otherwise acquired securities of VMware, Inc. (""VMware"") (NYSE: VMW) between March 30, 2019 and February 27, 2020. You are hereby notified that a securities class action lawsuit has been commenced in the the United States District Court for the Northern District of California. To get ..."
2020-05-31 08:00:00 -0400,"DEADLINE TOMORROW: The Schall Law Firm Announces It Has Filed a Class Action Lawsuit Against VMware, Inc. and Encourages Investors with Losses in Excess of $100,000 to Contact the Firm","Los Angeles, California--(Newsfile Corp. - May 31, 2020) -  The Schall Law Firm, a national shareholder rights litigation firm, announces the filing of a class action lawsuit against VMware, Inc. (""VMware"" or ""the Company"") (NYSE: VMW) for violations of §§10(b) and 20(a) of the Securities Exchange Act of 1934 and Rule 10b-5 promulgated thereunder by the U.S. Securities and Exchange Commission.Investors who purchased the Company's securities between March 30, 2019 and February 27, 2020, ..."
2020-05-29 16:15:00 -0400,VMware to Present at the Stifel 2020 Cross Sector Insight Virtual Conference,"VMware, Inc. (NYSE: VMW), a leading innovator in enterprise software, today announced that Rajiv Ramaswami, VMware’s chief operating officer, products and cloud services, will present at the Stifel 2020 Cross Sector Insight Virtual Conference on Tuesday, June 9, 2020 at 9:00 a.m. PT/ 12:00 p.m. ET."
2020-05-29 13:06:00 -0400,"The Law Offices of Frank R. Cruz Reminds Investors of Looming Deadline in the Class Action Lawsuit Against VMware, Inc. ","The Law Offices of Frank R. Cruz reminds investors of the upcoming June 1, 2020 deadline to file a lead plaintiff motion in the class action filed on behalf of investors who acquired VMware, Inc. (""VMware"" or the ""Company"") (NYSE: VMW) securities between March 30, 2019 and February 27, 2020, inclusive (the ""Class Period"")."
2020-05-29 10:06:02 -0400,"VMware Q1 Earnings Beat Estimates, Revenues Rise Y/Y","VMware's (VMW) first-quarter fiscal 2021 results reflect strong top-line growth, driven by robust performances by Carbon Black and VeloCloud offerings as well as VMware Cloud on AWS."
2020-05-29 09:44:00 -0400,"DEADLINE MONDAY: The Schall Law Firm Announces It Has Filed a Class Action Lawsuit Against VMware, Inc. and Encourages Investors with Losses in Excess of $100,000 to Contact the Firm","Los Angeles, California--(Newsfile Corp. - May 29, 2020) - The Schall Law Firm, a national shareholder rights litigation firm, announces the filing of a class action lawsuit against VMware, Inc. (NYSE: VMW) (""VMware"" or ""the Company"") for violations of §§10(b) and 20(a) of the Securities Exchange Act of 1934 and Rule 10b-5 promulgated thereunder by the U.S. Securities and Exchange Commission.Investors who purchased the Company's securities between March 30, 2019 and February 27, 2020, inclusive (the ..."
2020-05-29 08:15:28 -0400,"Dow Jones Today, Futures Tightly Mixed Ahead Of Trump China Conference; Coronavirus Vaccine Stocks Rise, Zscaler Spikes On Earnings","Zscaler and VMware soared on earnings, drugmakers led the Dow Jones today. Stock futures were mixed ahead of a Trump press conference on China."
2020-05-28 17:45:09 -0400,VMware Q1 Earnings and Revenues Beat Estimates,"VMware (VMW) delivered earnings and revenue surprises of 27.73% and 3.21%, respectively, for the quarter ended April 2020. Do the numbers hold clues to what lies ahead for the stock?"
2020-05-28 16:39:00 -0400,"VMware stock rises after earnings, revenue top expectations","VMware Inc.  shares rose 6.1% in the extended session Thursday after the company's earnings topped consensus estimates. The company reported fiscal first-quarter net income of $386 million, or 92 cents a share, compared with $380 million, or 89 cents a share, in the year-ago period. Adjusted for stock compensation, among other things, earnings were $1.52 a share. Revenue rose to $2.73 billion from $2.45 billion in the year-ago period. Analysts surveyed by FactSet had estimated adjusted earnings of $1.20 a share on revenue of $2.64 billion. For the fiscal second quarter, analysts model adjusted earnings of $1.44 a share and sales of $2.79 billion. VMware stock has fallen 6.1% this year, with the S&P 500 index  falling 6%."
2020-05-28 16:15:00 -0400,VMware Reports Fiscal Year 2021 First Quarter Results,VMware Reports Fiscal Year 2021 First Quarter Results
2020-05-28 15:16:00 -0400,VMware Looks Ready to Finally Break Its Longer-Term Downtrend,"VMware Inc.  has been in a longer-term downtrend but now it looks like it has the power to break out to the upside.  Let's check out the charts of this virtualization and cloud computing software provider as it reports it latest earnings.  In this daily bar chart of VMW, below, we can see that prices have been making lower highs and lower lows the past 12 months."
2020-05-28 09:50:00 -0400,"MONDAY DEADLINE NOTICE: The Schall Law Firm Announces It Has Filed a Class Action Lawsuit Against VMware, Inc. and Encourages Investors with Losses in Excess of $100,000 to Contact the Firm","Los Angeles, California--(Newsfile Corp. - May 28, 2020) - The Schall Law Firm, a national shareholder rights litigation firm, announces the filing of a class action lawsuit against VMware, Inc. (NYSE: VMW) (""VMware"" or ""the Company"") for violations of §§10(b) and 20(a) of the Securities Exchange Act of 1934 and Rule 10b-5 promulgated thereunder by the U.S. Securities and Exchange Commission.Investors who purchased the Company's securities between March 30, 2019 and February 27, 2020, inclusive (the ..."
2020-05-27 13:28:00 -0400,"VMware Deadline Alert: Faruqi & Faruqi, LLP Encourages Investors Who Suffered Losses Exceeding $50,000 In VMware, Inc. To Contact The Firm","New York, New York--(Newsfile Corp. - May 27, 2020) - Faruqi & Faruqi, LLP, a leading national securities law firm, reminds investors in VMware, Inc. (""VMware"" or the ""Company"") (NYSE: VMW) of the June 1, 2020 deadline to seek the role of lead plaintiff in a federal securities class action that has been filed against the Company. To view an enhanced version of this graphic, please visit:https://orders.newsfilecorp.com/files/6455/56633_3ee4966574bb18dd_001full.jpgIf you invested in VMware, Inc. stock ..."
2020-05-27 09:38:00 -0400,"MONDAY DEADLINE REMINDER: The Schall Law Firm Announces It Has Filed a Class Action Lawsuit Against VMware, Inc. and Encourages Investors with Losses in Excess of $100,000 to Contact the Firm","Los Angeles, California--(Newsfile Corp. - May 27, 2020) - The Schall Law Firm, a national shareholder rights litigation firm, announces the filing of a class action lawsuit against VMware, Inc. (NYSE: VMW) (""VMware"" or ""the Company"") for violations of §§10(b) and 20(a) of the Securities Exchange Act of 1934 and Rule 10b-5 promulgated thereunder by the U.S. Securities and Exchange Commission.Investors who purchased the Company's securities between March 30, 2019 and February 27, 2020, inclusive (the ..."
2020-05-26 09:44:00 -0400,"MONDAY DEADLINE ALERT: The Schall Law Firm Announces It Has Filed a Class Action Lawsuit Against VMware, Inc. and Encourages Investors with Losses in Excess of $100,000 to Contact the Firm","Los Angeles, California--(Newsfile Corp. - May 26, 2020) - The Schall Law Firm, a national shareholder rights litigation firm, announces the filing of a class action lawsuit against VMware, Inc. (NYSE: VMW) (VMware&quot; or &quot;the Company&quot;) for violations of §§10(b) and 20(a) of the Securities Exchange Act of 1934 and Rule 10b-5 promulgated thereunder by the U.S. Securities and Exchange Commission.Investors who purchased the Company's securities between March 30, 2019 and February 27, 2020, inclusive ..."
2020-05-22 16:15:00 -0400,VMware to Present at the Bank of America 2020 Global Technology Conference,"VMware, Inc. (NYSE: VMW), a leading innovator in enterprise software, today announced that Pat Gelsinger, VMware’s chief executive officer, will present as a keynote speaker at the virtual Bank of America 2020 Global Technology Conference on Wednesday, June 3, 2020 at 12:15 p.m. PT/ 3:15 p.m. ET."
2020-05-22 06:20:59 -0400,U.K. Contact-Tracing Virus App Roll-Out Delayed by Bureaucracy,"(Bloomberg) -- Britain’s mobile phone app for tracking coronavirus infections has been delayed by bureaucracy and the addition of more symptoms to monitor, according to a person familiar with the matter -- who said they expected the government to abandon it in favor of the model backed by Apple Inc and Alphabet Inc.’s Google.Prime Minister Boris Johnson pledged Wednesday that the U.K. would have a tracking-and-tracing system -- essential to lifting the current lockdown -- in place by June 1. But he emphasized recruiting 25,000 workers to trace potential cases, rather than using the app that was due in the middle of May.The app is being developed by VMware Inc. and Zuhlke Engineering Ltd at a cost of 4.7 million pounds ($5.8 million). Ther..."
2020-05-21 21:17:00 -0400,"ROSEN, A TOP RANKED LAW FIRM, Reminds VMware, Inc. Investors of Important Deadline in Securities Class Action Lawsuit; Encourages Investors With Losses In Excess of $100K to Contact the Firm - VMW","Rosen Law Firm, a global investor rights law firm, reminds purchasers of the securities of VMware, Inc. (NASDAQ: VMW) between March 30, 2019 and February 27, 2020, inclusive (the &quot;Class Period&quot;), of the important June 1, 2020 lead plaintiff deadline in the securities class action. The lawsuit seeks to recover damages for VMware investors under the federal securities laws."
2020-05-21 19:48:00 -0400,"UPCOMING DEADLINE ALERT: The Schall Law Firm Announces It Has Filed a Class Action Lawsuit Against VMware, Inc.","Los Angeles, California--(Newsfile Corp. - May 21, 2020) -  The Schall Law Firm, a national shareholder rights litigation firm, announces the filing of a class action lawsuit against VMware, Inc. (NYSE: VMW) (&quot;VMware&quot; or &quot;the Company&quot;) for violations of §§10(b) and 20(a) of the Securities Exchange Act of 1934 and Rule 10b-5 promulgated thereunder by the U.S. Securities and Exchange Commission.Investors who purchased the Company's securities between March 30, 2019 and February 27, 2020, ..."
2020-05-21 15:44:00 -0400,"The Law Offices of Frank R. Cruz Announces the Filing of a Securities Class Action on Behalf of VMware, Inc. Investors ","The Law Offices of Frank R. Cruz announces that a class action lawsuit has been filed on behalf of persons and entities that purchased or otherwise acquired VMware, Inc. (&quot;VMware&quot; or the &quot;Company&quot;) (NYSE: VMW) securities between March 30, 2019 and February 27, 2020, inclusive (the &quot;Class Period&quot;). VMware investors have until June 1, 2020 to file a lead plaintiff motion."
2020-05-21 12:30:04 -0400,Earnings Preview: VMware Q1 Earnings Expected to Decline,VMware (VMW) doesn't possess the right combination of the two key ingredients for a likely earnings beat in its upcoming report. Get prepared with the key expectations.
2020-05-20 08:00:00 -0400,VMware Showcases Customer and Product Innovations for Multi-Cloud Operations at CloudLIVE 2020,"Today at the annual CloudLIVE Conference hosted by VMware, Inc. (NYSE: VMW), CloudHealth by VMware customers will take center stage to share details of their multi-cloud journey and outline strategies for harnessing the power of cloud to drive innovation and growth. For these organizations, CloudHealth delivers multi-cloud operations capabilities that provide visibility, control, and cost optimization. VMware also announced new features in CloudHealth and VMware Secure State, including FlexOrgs and Savings Plan Recommendations, that will provide even deeper support for enterprises seeking to build more secure and compliant multi-cloud infrastructure, help prevent loss of control, and manage steadily climbing cloud bills."
2020-05-14 16:15:00 -0400,"VMware to Announce Fiscal Year 2021 First Quarter Financial Results on Thursday, May 28, 2020","VMware, Inc. (NYSE: VMW), a leading innovator in enterprise software, plans to announce fiscal year 2021 first quarter financial results after market close on Thursday, May 28, 2020. The company will host a conference call at 1:30 p.m. PT/ 4:30 p.m. ET that day to review financial results and business outlook. A live web broadcast of the event will be available on the VMware Investor Relations website at http://ir.vmware.com. The replay of the webcast will be available for two months."
2020-05-14 09:34:01 -0400,VMware to Acquire Kubernetes Security Platform Octarine,VMWare (VMW) announces intent to acquire Kubernetes security platform startup Octarine and the launch of its Next-Gen SOC Alliance at Connect 2020.
2020-05-14 08:00:00 -0400,‘Modern Bank Heists’ Threat Report from VMware Carbon Black Finds Dramatic Increase in Cyberattacks Against Financial Institutions Amid COVID-19,"VMware, Inc. (NYSE: VMW), a leading innovator in enterprise software, today released the third annual &quot;Modern Bank Heists&quot; report, produced by VMware Carbon Black. The report combines original VMware Carbon Black threat data analysis with annual survey results featuring responses from 25 leading financial institution CISOs."
2020-05-13 08:00:00 -0400,VMware Advances Intrinsic Security Strategy at Connect 2020 Announcing Intent to Acquire Octarine to Expand Workload Security Solution into Kubernetes and Creation of Next-Gen SOC Alliance,"VMware, Inc. (NYSE: VMW), a leading innovator in enterprise software, made two key announcements during Connect 2020, the company’s annual cybersecurity user and partner conference (hosted virtually by VMware Carbon Black):"
2020-05-12 10:17:16 -0400,VMware Has Compensated Shareholders With A Respectable 94% Return On Their Investment,"While VMware, Inc. (NYSE:VMW) shareholders are probably generally happy, the stock hasn't had particularly good run..."
2020-05-04 11:01:38 -0400,"Were Hedge Funds Right About VMware, Inc. ?","We hate to say this but, we told you so. On February 27th we published an article with the title Recession is Imminent: We Need A Travel Ban NOW and predicted a US recession when the S&P 500 Index was trading at the 3150 level. We also told you to short the market and buy […]"
