datetime,title,content
2020-10-28 13:53:24 -0400,VMware Has Gifted Shareholders With A Fantastic 184% Total Return On Their Investment,"When you buy a stock there is always a possibility that it could drop 100%. But on the bright side, if you buy shares..."
2020-10-28 08:00:00 -0400,"SaltStack, Now Part of VMware, to Showcase Innovation in IT Infrastructure Automation and SecOps at SaltConf20 Virtually Everywhere","SaltStack®, the creators of intelligent automation for security operations and IT teams, and now part of VMware, today announced the agenda for SaltConf20 Virtually Everywhere, its seventh-annual global user conference, taking place virtually on October 29, 2020. This year’s event will bring together IT and security operations professionals to learn about SaltStack’s latest innovations in ITOps, NetOps and SecOps and how to automate more secure and reliable digital infrastructure for modern business."
2020-10-27 08:00:00 -0400,VMware and Samsung Form Alliance to Accelerate Communication Service Providers’ Transformation to 5G,"VMware, Inc. (NYSE: VMW) today announced it has collaborated with Samsung Electronics Co., Ltd. to further extend its leadership in 5G. Through this alliance, the companies seek to help Communication Service Providers (CSPs) meet the requirements of 5G networks and accelerate the roll-out of 5G by optimizing Samsung’s portfolio of telco offerings from Core to Edge to RAN for both containerized network functions (CNFs) and virtualized network functions (VNFs) with VMware Telco Cloud Platform."
2020-10-26 10:00:00 -0400,Ignore Intel: Here Are 3 Better Stocks,"Intel's problems could take some time to work out. In the meantime, these three names look like better value stocks in the tech sector."
2020-10-26 06:30:00 -0400,These Companies Pay the Most in Stock Compensation,"Stock compensation is typically used by startups to keep cash burn at a minimum, and theoretically handsomely reward employees if there is a liquidity event such as an acquisition or initial public offering.  After an IPO, a typical tech company’s first several quarters of public life will nearly always be characterized by large losses caused by employee stock vesting, which translates to the stock compensation line item in the cash flow statement.  Equity is used by older businesses too as a means of giving employees additional compensation and retaining staff."
2020-10-20 06:00:00 -0400,VMware Releases Global Incident Response Threat Report Detailing Surge in Sophisticated Cyberattacks as eCrime Groups Grow More Powerful,"VMware, Inc. (NYSE: VMW), a leading innovator in enterprise software, today released the results of its sixth Global Incident Response Threat Report, entitled: &quot;The Cybersecurity Tipping Point: Election, COVID-19 Create Perfect Storm for Increasingly Sophisticated Cyberattacks.&quot;"
2020-09-29 13:02:13 -0400,"VMware, Inc. -- Moody's announces completion of a periodic review of ratings of VMware, Inc.","Announcement of Periodic Review: Moody's announces completion of a periodic review of ratings of VMware, Inc.  New York, September 29, 2020 -- Moody's Investors Service (""Moody's"") has completed a periodic review of the ratings of VMware, Inc. and other ratings that are associated with the same analytical unit.  The review was conducted through a portfolio review in which Moody's reassessed the appropriateness of the ratings in the context of the relevant principal methodology(ies), recent developments, and a comparison of the financial and operating profile to similarly rated peers."
2020-09-29 12:00:00 -0400,Lumen Teams With VMware to Expand Edge Compute Capabilities for the 4th Industrial Revolution,"VMworld 2020 — At VMworld 2020, Lumen Technologies (NYSE: LUMN) and VMware, Inc. (NYSE: VMW) are announcing a significant collaboration covering edge compute, networking, and security. VMware and Lumen Technologies, or simply Lumen, are taking their current partnership further with the agreement for Lumen to deliver edge services using integrated VMware technologies. This collaboration will help enterprises expand across data center, cloud and edge, moving business applications that require low latency and efficient localization closer to digital interactions. At VMworld, Lumen and VMware will be presenting:"
2020-09-29 12:00:00 -0400,VMware and NVIDIA to Enable Next-Gen Hybrid Cloud Architecture and Bring AI to Every Enterprise,"VMworld 2020 — At VMworld 2020, VMware and NVIDIA today announced a broad partnership to deliver both an end-to-end enterprise platform for AI and a new architecture for data center, cloud and edge that uses NVIDIA® DPUs (data processing units) to support existing and next-generation applications."
2020-09-29 08:07:28 -0400,"VMware, Nvidia partner to make AI chips easier for businesses to use","VMware makes software that helps businesses get more work out of data center servers by slicing physical machines into ""virtual"" ones so that more applications can be packed onto each physical machine.  Its tools are commonly used by large businesses that operate their own data centers as well as businesses that use cloud computing data centers."
2020-09-29 08:00:00 -0400,"VMware Delivers the Next Wave of Virtual Cloud Network Innovation to Connect and Protect Today’s Distributed, Multi-Cloud Enterprise","VMworld 2020 — Today at VMworld 2020, VMware, Inc. (NYSE: VMW) unveiled Virtual Cloud Network innovations that will help customers create a modern network that better supports current and future business initiatives. With advancements across the VMware networking and security portfolio, customers will be able to more effectively manage the rapid shift to remote work, deliver traditional and modern applications faster and more securely, and reduce the cost and complexity of connecting and protecting the distributed enterprise."
2020-09-29 08:00:00 -0400,VMware Delivers Intrinsic Security to the World’s Digital Infrastructure,"VMworld 2020 — This week at VMworld 2020, VMware, Inc. (NYSE: VMW) unveiled new innovations to deliver intrinsic security to the world’s digital infrastructure. The solutions are designed to advance security for the public and private clouds, security operations and distributed workforces as organizations accelerate cloud adoption to build resilient, future ready digital infrastructure."
2020-09-29 08:00:00 -0400,VMware Expands Tanzu Portfolio and Partnerships to Accelerate Customers’ Infrastructure and Application Modernization Efforts,"VMworld 2020 — At VMworld 2020, VMware, Inc. (NYSE: VMW) announced updates to Tanzu support across VMware Cloud on AWS, Azure VMware Solution, and Oracle Cloud VMware Solution, and a partnership with GitLab. Introduced at VMworld 2019 US, VMware Tanzu is a portfolio of products and services for modernizing applications and infrastructure with a common goal: deliver better software to production, continuously. Over the last year, VMware has rapidly added to the Tanzu portfolio, expanded its partner ecosystem, and added new customers."
2020-09-29 08:00:00 -0400,VMware Announces Future Ready Workforce Solutions to Address the Needs of the Distributed Workforce,"This week at VMworld 2020, VMware, Inc. (NYSE: VMW) is announcing VMware Future Ready Workforce solutions to provide exceptional workforce experiences, end-to-end Zero Trust security controls, and simplified management. The Future Ready Workforce solutions combine VMware Secure Access Service Edge (SASE), Digital Workspace and Endpoint Security capabilities to help IT manage and optimize more secure access to any app, on any cloud, from any device while providing a simple, high performant, and a safer user experience for the distributed workforce."
2020-09-29 08:00:00 -0400,VMware Empowers Customers to Build their Multi-Cloud Future,"VMworld 2020 — This week at VMworld 2020, VMware, Inc. (NYSE: VMW) announced new innovations to help customers build, run, manage, connect, and protect any app on any cloud. Today, more than 15 million enterprise workloads run on VMware in the cloud, and more than 4,300 partners offer VMware-based cloud services. This includes all major public cloud providers. With these new and updated offerings, customers and partners can unlock multi-cloud’s full potential value by providing more developer freedom while providing IT with consistent and efficient security and operations."
2020-09-26 11:30:03 -0400,VMware Down 0.9% Since Last Earnings Report: Can It Rebound?,VMware (VMW) reported earnings 30 days ago. What's next for the stock? We take a look at earnings estimates for some clues.
2020-09-24 09:45:00 -0400,"Amdocs, Microsoft, VMware, Other Technology Leaders Join 5G Open Innovation Lab as Founding Partners to Help Start-Ups, Entrepreneurs Develop Groundbreaking 5G Services, Applications","The 5G Open Innovation Lab (5GOILab), a global ecosystem of developers, enterprises and government institutions, today announced that Amdocs (NASDAQ: DOX), Dell Technologies, Microsoft (NASDAQ: MSFT), and VMware (NYSE: VMW) have joined the Lab as founding partners providing engineering and technology resources to the Lab's diverse start-up ecosystem. Founding partners Intel, NASA and T-Mobile, who launched the Lab in May, welcomed the new members who will broaden the Lab participants' access to leading-edge network, software and hardware platforms, in addition to creating direct customer relationships that accelerate market adoption."
2020-09-22 08:00:00 -0400,VMworld Demonstrates What is ‘Possible Together’ in 2020 and Beyond,"VMware, Inc. (NYSE: VMW), a leading innovator in enterprise software, today announced the General Session keynote speakers and the conference sponsorships for VMworld® 2020\. Beginning Sept. 29, 2020, VMworld 2020 will welcome attendees to experience the completely digital VMworld under the theme of what’s &quot;possible together.&quot; Key focus areas of VMworld include app modernization, multi-cloud, virtual cloud network, digital workspace, intrinsic security and telco – as well as on emerging trends and the future impact of technology in today’s uncertain world and beyond."
2020-09-17 17:07:25 -0400,4 Software Stocks Trading Below the GF Value Line,These companies are modestly undervalued based on a number of metrics
2020-09-15 14:22:19 -0400,"Stripe Employees Who Relocate to Get $20,000 Bonus and a Pay Cut","(Bloomberg) -- Stripe Inc. plans to make a one-time payment of $20,000 to employees who opt to move out of San Francisco, New York or Seattle, but also cut their base salary by as much as 10%, according to a person familiar with the matter.The payments processor will make the offer available to workers who choose to relocate before the end of the year, said the person, who asked to remain anonymous to discuss private details. But employees opting to move may have to relinquish some of their base pay.The new policy adds Stripe to the list of technology companies that have expanded opportunities for employees to work remotely while also signaling they may implement pay cuts if workers move to less-expensive cities. VMware Inc. told Bloomber..."
2020-09-15 08:00:00 -0400,VMware Unlocks the Power of Kubernetes for 70 Million-Plus Workloads Running on vSphere,"VMware, Inc. (NYSE: VMW) today unveiled new offerings to help customers further accelerate their app and infrastructure modernization initiatives. VMware vSphere 7 Update 1, VMware vSAN 7 Update 1 and VMware Cloud Foundation 4.1 product releases streamline customer adoption of Kubernetes and support stateful applications with new developer-ready capabilities and enhance scalability and operations with new features. VMware today also announced Tanzu editions—packaging portfolio capabilities to address the most common scenarios customers encounter in their modernization efforts."
2020-09-14 15:46:21 -0400,Dell to Trim Workforce This Week in Move to Stay Competitive,"(Bloomberg) -- Dell Technologies Inc. notified employees that it will eliminate jobs this week as the hardware giant seeks to cut costs while navigating a faltering global economy.Chief Operating Officer Jeff Clarke told staff during a quarterly all-hands meeting Monday that the workforce reductions won’t be limited to any particular team or division within Dell, said a person familiar with the situation, who asked not to be identified discussing internal meetings.“We’re also evaluating our business to make sure we have the right number of team members in the right roles and in areas where customers need us most,” a Dell spokesman said in a statement. Round Rock, Texas-based Dell has faced uneven demand during the coronavirus pandemic. Wh..."
2020-09-11 14:47:22 -0400,"VMware, Twitter Cut Pay for Remote Workers Fleeing Bay Area","(Bloomberg) -- VMware Inc. employees who take up the company’s offer to become permanent remote workers will get a pay cut if they move from Silicon Valley, one of the nation’s most costly areas to live, to a less-expensive city.The software maker has joined technology companies such as Facebook Inc. and Twitter Inc. in letting some of its office staff choose to permanently work from home in the wake of the coronavirus pandemic. But employees who worked at VMware’s Palo Alto, California, headquarters and go to Denver, for example, must accept an 18% salary reduction, people familiar with the matter said. Leaving Silicon Valley for Los Angeles or San Diego means relinquishing 8% of their annual pay, said the people, who asked not to be ide..."
2020-09-09 16:15:00 -0400,"VMware to Present at the Piper Sandler P.S. It's Friday: ""5G vs LTE: Find Out What It Means to Me"" | 5G Infrastructure Virtual Event","VMware, Inc. (NYSE: VMW), a leading innovator in enterprise software, today announced that Shekar Ayyar, VMware’s executive vice president & general manager, telco edge & cloud business unit, will present at the Piper Sandler P.S. It's Friday: &quot;5G vs LTE: Find Out What It Means to Me&quot; | 5G Infrastructure Virtual Event on Friday, September 18, 2020 at 8:00 a.m. PT/ 11:00 a.m. ET."
2020-09-09 08:55:00 -0400,Why Dell Technologies Rose 10.4% in August,"The tech conglomerate reported better-than-expected earnings during the month, and investors may also be looking toward a value-add catalyst next year."
2020-09-09 08:00:00 -0400,VMware Named a Leader in Evaluation of Infrastructure Automation Platforms by Independent Research Firm,"VMware, Inc. (NYSE: VMW) today announced that market research firm Forrester Research has named VMware a leader among infrastructure automation platform providers in a Q3 2020 report based on a 26-criterion evaluation."
2020-09-07 12:51:54 -0400,"Hedge Funds Are Flocking Into VMware, Inc. ",At the end of February we announced the arrival of the first US recession since 2009 and we predicted that the market will decline by at least 20% in (see why hell is coming). We reversed our stance on March 25th after seeing unprecedented fiscal and monetary stimulus unleashed by the Fed and the Congress. […]
2020-09-04 16:15:00 -0400,VMware to Present at the Deutsche Bank Technology Conference,"VMware, Inc. (NYSE: VMW), a leading innovator in enterprise software, today announced that Pat Gelsinger, VMware’s chief executive officer, will present at the Deutsche Bank Technology Conference as part of a pre-recorded panel discussion on leadership, on Tuesday, September 15, 2020 at 4:20 a.m. PT/ 7:20 a.m. ET."
2020-09-03 16:15:00 -0400,VMware to Present at the Jefferies Virtual Software Conference,"VMware, Inc. (NYSE: VMW), a leading innovator in enterprise software, today announced that Sanjay Poonen, VMware’s chief operating officer, customer operations will present at the Jefferies Virtual Software Conference on Tuesday, September 15, 2020 at 12:30 p.m. PT/ 3:30 p.m. ET."
2020-09-01 08:00:00 -0400,VMware Advances Its 5G Telco Cloud Portfolio with Cloud Native Support to Accelerate 5G and Edge Innovation,"VMware, Inc. (NYSE: VMW) today announced its 5G Telco Cloud Platform, a consistent cloud first solution powered by a field proven, carrier-grade, and high-performance cloud native infrastructure with intelligent automation. This new platform includes Tanzu Kubernetes Grid - an embedded Kubernetes distribution - that will allow Communication Service Providers (CSPs) to reliably build, manage and run containerized workloads across private, telco, edge and public clouds."
2020-08-31 08:00:00 -0400,VMware Named a Leader in the 2020 Gartner Magic Quadrant for Unified Endpoint Management for Third Year in a Row,"VMware, Inc. (NYSE: VMW) today announced it has been positioned by Gartner, Inc. as a Leader in the 2020 Magic Quadrant for Unified Endpoint Management (UEM). According to Gartner, VMware has been evaluated for its ability to execute and completeness of vision."
2020-08-28 13:54:00 -0400,Dell and HP’s PC Sales Are Soaring. Here’s What Is Really Driving Their Stocks Higher.,"HP Inc. and Dell Technologies reported better-than-expected July quarter results, thanks in part to strong PC demand."
2020-08-28 10:30:46 -0400,VMware Inc Q2 2021 Earnings Call Transcript,"VMW earnings call for the period ending July 31, 2020."
2020-08-28 08:45:12 -0400,"VMware Q2 Earnings Beat Estimates, Revenues Rise Y/Y","VMware's (VMW) second-quarter fiscal 2021 results reflect strong top-line growth, driven by robust Subscription & SaaS, VMware Cloud on AWS as well as lower expenses."
2020-08-27 17:23:00 -0400,"Dell, VMware shares rise on strength of working from home",Dell Technologies Inc. shares climbed higher in the extended session Thursday as the computing company’s revenue beat Wall Street expectations. Dell (DELL) shares rose 1.8% in after-hours trading after closing the regular session at $62.
2020-08-27 16:30:00 -0400,Dell Profit Tops Estimates on Strong Cost Controls and Consumer PC Demand,"Product revenue was down 7% in the quarter, while services revenue rose 10%.  In the previous quarter, Dell implemented a hiring freeze and curtailed almost all corporate travel.  Revenue in the company’s Client Solutions Group, which includes personal computers, was $11.2 billion, falling about $300 million short of the Street consensus."
2020-08-27 16:26:03 -0400,Dell Revenue Tops Estimates on PC Boost From Virtual Learning,"(Bloomberg) -- Dell Technologies Inc. reported revenue and profit that topped analysts’ estimates, in a sign of strong demand for personal computers from workers and students stuck at home during the coronavirus pandemic.Sales were $22.7 billion in the period that ended July 31, the Round Rock, Texas-based company said Thursday in a statement. Analysts, on average, projected $22.5 billion, according to data compiled by Bloomberg. The hardware giant reported earnings, excluding some items, of $1.92 a share, easily beating estimates of $1.38 a share. Dell shares rose about 4% in extended trading after the results. Chief Executive Officer Michael Dell is once again looking to revamp the structure of his technology empire, this time to genera..."
2020-08-27 16:15:00 -0400,VMware Reports Fiscal Year 2021 Second Quarter Results,VMware Reports Fiscal Year 2021 Second Quarter Results
2020-08-26 16:15:00 -0400,VMware to Present at the Citi Global Technology Virtual Conference,"VMware, Inc. (NYSE: VMW), a leading innovator in enterprise software, today announced that Pat Gelsinger, VMware’s chief executive officer, will present as a keynote speaker at the Citi Global Technology Virtual Conference on Wednesday, September 9, 2020 at 9:35 a.m. PT/ 12:35 p.m. ET."
2020-08-24 11:49:03 -0400,VMware to Report Q2 Earnings: What's in the Cards?,VMware's (VMW) second-quarter fiscal 2021 results are expected to reflect benefits of a strong portfolio despite lower on-premise IT spending and bleak demand due to coronavirus outbreak.
2020-08-20 08:00:00 -0400,VMware Brings Kubernetes to Fusion 12 and Workstation 16 Releases,"VMware, Inc. (NYSE: VMW), a leading innovator in enterprise software, today unveiled the newest versions of its VMware Fusion and VMware Workstation desktop hypervisor solutions. VMware’s updates support the changing needs of modern developers by extending the tools traditionally used to simplify workflows and expand capabilities of virtual machines (VMs) to container-based applications orchestrated with Kubernetes. The latest release of Fusion also introduces a new edition—Fusion Player—available with a free Personal Use license as well as offering a paid license for commercial use."
2020-08-18 08:00:00 -0400,VMware Enhances Self-Driving Operations and Programmable Automation With Updates Across vRealize Cloud Management,"VMware, Inc. (NYSE: VMW) today announced innovations across its portfolio of VMware vRealize Cloud Management on-premises and software as a service (SaaS) offerings. The new and enhanced product capabilities combine to further enable customers to consistently deploy and operate their applications, infrastructure, and platform services, from the data center to the cloud to the edge."
2020-08-17 15:04:16 -0400,"Should You Think About Buying VMware, Inc. Now?","VMware, Inc. (NYSE:VMW) saw significant share price movement during recent months on the NYSE, rising to highs of..."
2020-08-13 16:15:00 -0400,"VMware to Announce Fiscal Year 2021 Second Quarter Financial Results on Thursday, August 27, 2020","VMware, Inc. (NYSE: VMW), a leading innovator in enterprise software, plans to announce fiscal year 2021 second quarter financial results after market close on Thursday, August 27, 2020. The company will host a conference call at 1:30 p.m. PT/ 4:30 p.m. ET that day to review financial results and business outlook. A live web broadcast of the event will be available on the VMware Investor Relations website at http://ir.vmware.com. The replay of the webcast will be available for two months."
2020-08-07 12:33:59 -0400,10 Biggest Software Companies,"With Microsoft leading the pack, these are the 10 biggest software companies by 12-month trailing revenue."
2020-08-05 08:00:00 -0400,Intel and VMware Extend Virtualization to Radio Access Network Through Broadened Collaboration For 5G,"Today, Intel (Nasdaq: INTC) and VMware, Inc. (NYSE: VMW) announced they are collaborating on an integrated software platform for virtualized Radio Access Networks (RAN) to accelerate the rollout of both existing LTE and future 5G networks. As communications service providers (CoSPs) evolve their networks to support the rollout of future 5G networks, they are increasingly adopting a software-defined, virtualized infrastructure. Virtualization of the core network has already enabled CoSPs to improve operational costs and bring services to market faster. This expanded collaboration between Intel and VMware aims to offer CoSPs reduced development cycles and scale across multiple designs."
2020-07-31 08:07:43 -0400,Dish chooses VMware's cloud platform for building 5G network,STOCKHOLM (Reuters) - U.S. satellite TV provider Dish Network <DISH.O> said on Friday it had opted for software maker VMware Inc's <VMW.N> telco cloud platform to build its next-generation wireless network.
2020-07-31 08:00:00 -0400,"DISH Selects VMware to Help Build the Most Advanced, Automated, End-to-End 5G Network in the U.S.","DISH (NASDAQ:DISH) today announced that it has chosen VMware (NYSE:VMW) for the cloud platform to deploy the nation’s first 5G, cloud-native Open Radio Access Network (O-RAN). The platform will help bring to life the first network in the U.S. to combine the efficiency of the distributed telco cloud, public cloud and private cloud environments while delivering consistent, low-latency edge computing. In addition to DISH’s selection of the VMware Telco Cloud platform, the company also selected cloud infrastructure services to support the IT needs of the broader DISH enterprise."
2020-07-30 17:50:09 -0400,VMware Dips More Than Broader Markets: What You Should Know,"VMware (VMW) closed the most recent trading day at $138.88, moving -0.68% from the previous trading session."
2020-07-30 13:27:02 -0400,5 Bargain Stocks With High Profitability,Booking Holdings tops the list Continue reading...
2020-07-21 08:00:00 -0400,VMware Shows Continued Momentum for Partner Connect Program; Announces Cloud Native Master Services Competency to Run and Manage Modern Apps,"VMware, Inc. (NYSE:VMW), a leading innovator in enterprise software, today announced continued momentum in its Partner Connect program with the addition of a new VMware Cloud Native Master Services Competency (MSC), the first competency related to the VMware Tanzu portfolio. This new Cloud Native MSC will provide a foundational step to enable current and future partners to architect a Kubernetes-based platform supported by complementary technologies from the cloud native ecosystem for continuous delivery of applications and is intended to recognize partners who specialize in Kubernetes operations, site reliability engineering and DevOps."
2020-07-17 10:29:25 -0400,Dell Stock at 14-Month High After Confirming Spin-Off Talks,"Dell Technologies Inc. (DELL) just confirmed that it's exploring a spin-off of majority-held VMware, Inc. (VMW), lifting Dell stock to a 14-month high while VMware sold off.  Dell stock underperformed badly after the December 2018 initial public offering (IPO), spending the majority of the past 19 months trading below the $46 IPO opening print.  This laggard behavior has encouraged market players to wonder why Michael Dell chose to abandon the privately held status after removing the company from the Nasdaq 100 in 2013."
2020-07-16 14:53:06 -0400,Will VMware Multiply In Value Going Forward?,"Did you know there are some financial metrics that can provide clues of a potential multi-bagger? Firstly, we'd want..."
