datetime,title,content
2020-08-14 17:45:09 -0400,Zoom Video Communications Dips More Than Broader Markets: What You Should Know,"Zoom Video Communications (ZM) closed the most recent trading day at $244.91, moving -0.95% from the previous trading session."
2020-08-12 09:15:00 -0400,Salesforce Cashes Out Its Zoom Video Profits. Should You?,"When Zoom Video Communications (NASDAQ: ZM) went public in April 2019, no one could have predicted that the world would soon be hit by a viral pandemic that would fundamentally alter the fabric of society.  It wasn't until the COVID-19 crisis started to escalate in early 2020 that Zoom started to see an astronomical surge in engagement, quickly becoming a household name as demand for videoconferencing services among consumers and businesses skyrocketed.  Salesforce Ventures had invested $100 million in Zoom through a concurrent private placement that took place alongside the IPO."
2020-08-11 15:53:00 -0400,Zoom Video’s stock sinks below 50-day moving average after Salesforce unloads stake,"Shares of Zoom Video Communications Inc. sank for a fourth-straight day Tuesday, falling below some key chart levels in the process, after Salesforce.com Inc. disclosed that it recently sold off its entire stake in the video-conferencing company."
2020-08-11 13:22:02 -0400,Traders Look to the IPO Market for Their Next Idea,The IPO market represents some of the most trend-setting business. These charts show recently public companies poised for gains.
2020-08-06 12:12:53 -0400,From Class Rooms to Class Zooms: Teaching During COVID Times!,"As some of you who have visited my website and read my bio know, I describe myself first and foremost as a teacher, and every semester, for the last decade, I have invited anyone who is interested to join in my classes. In December 2019, when I posted my last invite, I fully expected to be teaching corporate finance […]"
2020-08-05 08:00:00 -0400,These 3 Tech Stocks Are Absurdly Overvalued Right Now,"High-growth tech stocks aren't usually considered defensive investments, but many of them are naturally insulated from the COVID-19 crisis and other macro headwinds.  Here's a trio of beloved tech stocks that have generated huge returns, but could be running out of room to run: Zoom Video Communications (NASDAQ: ZM), Pinduoduo (NASDAQ: PDD), and ServiceNow (NYSE: NOW).  Its revenue rose 88% in fiscal 2020, which ended this January, as its adjusted net income soared 514%."
2020-08-05 04:59:00 -0400,"After COVID-19, what is the future of health care for older Americans?",Here’s what experts forecast regarding telehealth and physicians specializing in geriatrics post-pandemic.
2020-08-04 12:30:00 -0400,Better Buy: Zoom Video Communications vs. Microsoft,"Zoom Video Communications (NASDAQ: ZM) was one of the hottest growth stocks of the year, rallying over 270% as the COVID-19 crisis brought millions of new users to its video collaboration platform.  Zoom easily outpaced Microsoft's 30% gain this year, and it likely remains a more appealing stock for growth-oriented investors.  Zoom has a market cap of more than $70 billion, but it's dwarfed by Microsoft's valuation of over $1.5 trillion."
2020-08-04 09:11:11 -0400,Is Dropbox Stock a Buy?,"Dropbox (NASDAQ: DBX) went public in March 2018 at $21 per share, surged to nearly $40 just three months later, then gradually gave up those gains and settled back to the low $20s. The cloud storage service provider initially impressed the bulls with its robust growth in users and revenue."
2020-08-03 13:59:00 -0400,Why Zoom Stock Jumped on Monday,"What happened Shares of Zoom Video Communications (NASDAQ: ZM) jumped sharply on Monday. As of 1:55 p.m. EDT, the stock was up by about 6.5%. Those gains were likely driven by a combination of an upbeat day in the overall market and outsize strength among growth stocks like Zoom."
2020-08-03 12:01:00 -0400,3 Stocks to Watch in August,"Earnings season is just getting rolling, and these tech names could make big moves -- either up or down."
2020-08-03 11:21:00 -0400,Zoom Ends Direct Software Sales in China as U.S. Political Pressures Rise,"(ZM) said on Monday that it had ended direct sales of its software in China.  The move comes amid increasing scrutiny of the company’s operations in China, with two senators last week calling for a Justice Department investigation of the company’s ties to the Chinese Communist Party.  “Our go-to-market model in mainland China has included direct sales, online subscription, and sales through partners,” Zoom (ticker: ZM) said in a statement."
2020-08-03 05:09:35 -0400,Zoom to shift to 'partner-only' model in China,"SHANGHAI (Reuters) - Zoom Video Communications will shift to a partner-only model in mainland China from Aug. 23, the company said on Monday."
2020-08-01 12:50:00 -0400,Why This Zoom Video Communications Bear Changed His Mind,"Did you know what Zoom Video Communications (NASDAQ: ZM) was?  Financial fortitude: Zoom has about $1.4 billion in cash, almost no long-term debt, and has brought in $350 million in free cash flow over the past year."
2020-08-01 09:00:00 -0400,3 Stay-at-Home Stocks to Buy in August,Companies that are benefiting from folks spending more time at home are good. Companies that offer a better experience than the real-world process they're replacing are great.
2020-07-31 15:59:07 -0400,"3 Tech Stocks to Buy for Explosive Growth After Apple, FB & Amazon Impress",Let's dive into three tech stocks that have soared recently and look ready for more growth...
2020-07-29 09:00:00 -0400,"Got $1,500 to Invest? Buy These 3 Tech Stocks Poised for Explosive Growth Over the Next Decade","While the S&P 500 is flat so far in 2020, the tech-heavy Nasdaq has trounced the returns of the broader market, gaining more than 17%.  The Nasdaq has outperformed both the S&P 500 and the Dow Jones Industrial Average over the one-year, three-year, five-year, and 10-year periods.  In fact, over the past decade, the Nasdaq has returned a whopping 359%, with the Dow Jones and S&P 500 returning just 153% and 191%, respectively."
2020-07-29 08:29:00 -0400,2 Stocks That Have Doubled in 2020 and Look Good for More,"The novel coronavirus pandemic has caused a significant shift in the way people work, with shelter-in-place orders and lockdowns sending a hefty chunk of the workforce across the globe toward remote work as offices have shuttered to contain the spread of COVID-19.  Surveys conducted by third parties and compiled by IT company Riverbed Technology reveal that 88% of organizations have implemented remote working models, with 31% of the respondents suggesting that COVID-19 has triggered the shift.  Zoom Video Communications (NASDAQ: ZM) and Twilio (NYSE: TWLO) are two such companies that have benefited from the shift to remote working, delivering huge gains to investors in the process."
2020-07-28 17:45:09 -0400,Zoom Video Communications Stock Moves -0.06%: What You Should Know,"Zoom Video Communications (ZM) closed at $252.18 in the latest trading session, marking a -0.06% move from the prior day."
2020-07-24 14:44:07 -0400,Why Remote Work Stocks Fell Today,Investors are taking profits off the table for momentum stocks that have rallied during the ongoing COVID-19 pandemic.
2020-07-22 17:45:09 -0400,Zoom Video Communications Gains But Lags Market: What You Should Know,"Zoom Video Communications (ZM) closed the most recent trading day at $261.18, moving +0.28% from the previous trading session."
2020-07-22 12:04:03 -0400,Slack Urges EU to Probe Microsoft Amid Covid-19 Video Boom,"(Bloomberg) -- Slack Technologies Inc. urged European Union antitrust regulators to probe Microsoft Corp. for unfairly foisting its Teams collaborative software on millions of users.“Microsoft has illegally tied its Teams product into its market-dominant Office productivity suite, force installing it for millions, blocking its removal, and hiding the true cost to enterprise customers,” Slack said in an emailed statement on Wednesday.The complaint escalates a fierce rivalry among videoconferencing and collaboration tools, amid exploding demand as the coronavirus pandemic pushed businesses to shutter offices and move to remote work. Teams vies with Slack and Zoom Video Communications Inc. for corporate customers.Slack is asking the European..."
2020-07-21 20:38:45 -0400,"Zoom: Work from Home is Here to Stay, But This Analyst Says Hold Off","More by accident than design, Zoom (ZM) has perfectly captured the zeitgeist in 2020. Far from a household name before the coronavirus struck, the viral outbreak has catapulted the video conferencing platform into millions of living rooms, studies, and home offices around the world. Not to mention investors have reaped hefty rewards with the platform’s rise in popularity (the stock is up 285% year-to-date).While Zoom has become the public’s remote communication tool of choice, not all users and employees – spread out across all demographics of society – are tech savvy enough to set up the equipment and software needed to make use of the platform. To address this issue, Zoom has partnered with video-conferencing appliance maker DTEN to cre..."
2020-07-21 05:01:12 -0400,Zoom Expands In India With New Tech Center As Demand Surges,"Zoom Video Communications Inc. (ZM) has announced that it is planning to expand its international presence by opening a technology center in Bangalore, India. The popular video conferencing service currently houses two data-centers in Mumbai and Hyderabad which also serve as research and development locations. The new location will support Zoom’s engineering division that is based in San Jose, California.“Zoom is focused on providing the best-unified communications experience in the world and we are thrilled to open a technology center in Bangalore, which will be an innovation hub for our communications platform,” said Zoom President of Product and Engineering Velchamy Sankarlingam, “The talent in India is truly exceptional and we are loo..."
2020-07-21 04:34:26 -0400,Zoom to open tech centre in India's Bengaluru,"Zoom Video Communications Inc <ZM.O> said on Tuesday it will open a technology centre in the southern Indian city of Bengaluru and soon begin hiring as part of an expansion push in the country.  Potential areas of expansion for the new technology centre include research and development, IT, security as well business operations, Velchamy Sankarlingam, Zoom's president of product and engineering, told a virtual news conference.  San Jose, California-based Zoom already has an office and a data centre in India's financial capital Mumbai and a second data centre in Bengaluru."
2020-07-20 18:28:00 -0400,Why Zoom Stock Jumped Today,"What happened Shares of Zoom Video Communications (NASDAQ: ZM) climbed 9% on Monday, as COVID-19 case counts surge in the U.S. and around the world. So what More than 3.8 million Americans have contracted COVID-19 and over 140,000 have died, according to data compiled by Johns Hopkins University."
2020-07-20 17:03:59 -0400,"Dow Jones Futures: Coronavirus Stock Market Rally Getting Extended As Tesla, Amazon, Adobe, Microsoft, Shopify, Zoom, Lululemon Surge","Growth ruled Monday, with Tesla, Amazon, Shopify and Zoom big winners. But the coronavirus stock market rally is already getting extended again."
2020-07-19 07:10:00 -0400,These 3 Stocks Near All-Time Highs Will Be Dangerous When the Next Crash Comes,"If there's a market crash, investors typically shed their portfolios of their most expensive holdings and look for cover in safer stocks that aren't trading at sky-high prices.  Quidel (NASDAQ: QDEL) shares are up a staggering 220% since the beginning of 2020, while the S&P 500 is flat.  The diagnostics and research company's been on fire since the U.S. Food and Drug Administration (FDA) granted emergency use authorization (EUA) for its Lyra SARS-CoV-2 Assay, a rapid point-of-care test, on March 17."
2020-07-17 13:45:16 -0400,People are overpaying for work from home stocks: Strategist  ,"Clark Kendall, Kendall Capital President & CEO joins the On the Move panel to discuss work from home stocks and the markets response to the pandemic."
2020-07-17 11:11:00 -0400,Zoom Barrels Into Sports VIP Market With Formula 1 Collaboration,"A company that is pushing into nearly every aspect of remote media these days, Zoom Video Communications (NASDAQ: ZM), has crossed another frontier.  On Thursday, the company announced a new tie-up with Formula 1 to provide remote VIP services to members of the motorsports company's high-end Paddock Club.  In nonpandemic times, the Paddock Club is a package of luxury services for viewing Formula 1 races."
2020-07-17 08:15:00 -0400,Zoom Video’s First Consumer Hardware Effort Doesn’t Make Much Sense,"Zoom Video Communications (NASDAQ: ZM) recently revealed its first consumer-oriented hardware device, the DTEN ME, a 27-inch smart screen sporting three wide-angle cameras, eight microphones, and a touchscreen display.  The $599 screen, developed by Zoom's hardware partner DTEN, is currently available for pre-order and slated to ship in August for U.S. customers.  Zoom became a household name during the COVID-19 pandemic, and it likely believes it can leverage that clout to sell hardware devices."
2020-07-16 19:00:45 -0400,Growth Stocks Are Eating the World. Live With It,"(Bloomberg Opinion) -- It’s not hard to see why investors in Asia have been blindly chasing growth stocks. For the past 10 years, value has consistently underperformed. As the world goes through another round of stimulus, money will continue to flow to companies that promise the fastest expansion. This self-perpetuating trend is forcing a change in how some investors assess value.There are many reasons why value stocks have lagged behind. Much of the phenomenon reflects the ultra-low interest rates that have prevailed since the global financial crisis. Lower rates make investing in growth stocks more attractive. At the same time, they hurt financial companies by compressing their net interest margins — the difference between the rates at ..."
2020-07-16 16:23:55 -0400,'China’s goal is to replace you': Barr warns leaders of America biggest businesses,"<small><time class=""timeago"" title=""2020-07-16 16:23:55 -0400"" dateTime=""2020-07-16T16:23:55-04:00"">2020-07-16T16:23:55-04:00</time></small>
      <br />
      U.S. Attorney General Bill Barr delivered a blistering critique of the Chinese Government Thursday and singled out U.S. business leaders as complicit in the country's rise. 

Speaking at the Gerald R. Ford Presidential Museum in Grand Rapids, Michigan, he pointed to tech companies like Apple (AAPL) and Cisco (CSCO), as well as Disney (DIS) as examples of American firms &quot;bowing to Beijing.&quot;"
2020-07-16 12:30:00 -0400,Better Buy: Zoom Video Communication vs. Apple,Choosing to use products from two tech companies is a no brainer. Deciding on which stock to buy is a harder choice.
2020-07-16 07:23:52 -0400,"Is Zoom Video Communications, Inc.'s Recent Stock Performance Influenced By Its Fundamentals In Any Way?",Zoom Video Communications' (NASDAQ:ZM) stock is up by a considerable 71% over the past three months. We wonder if and...
2020-07-16 07:20:05 -0400,Zoom Launches Its Own Video-Conferencing Hardware For In-Home Use,"Zoom Video (ZM) has announced that it will be selling hardware to accompany its popular video conferencing technology.The company will be adding a product category which will be a third-party developed display that will incorporate Zoom’s software. It will be called Zoom for Home DTEN ME, a name that reflects Zoom’s joint partnership with the manufacturer, DTEN in developing the product. The all-in-one 27-inch smart display will incorporate its built-in cameras, microphone, and touch capabilities at an estimated price of $599 starting next month. In an interview with Tech Crunch on July 15, Head of Zoom Rooms Jeff Smith said, “Zoom for Home is an initiative from Zoom that allows any Zoom user to deploy a personal collaboration device for ..."
2020-07-16 04:54:01 -0400,"India's Reliance seen emerging as bigger threat for U.S. firms like Amazon, Walmart","A $20 billion fund raising spree may take India's Reliance <RELI.NS> closer to its dream of becoming a digital giant, further threatening the ambitious plans U.S. companies like Amazon <AMZN.O>, Walmart <WMT.N> and Zoom have for India.  Stake sales in Reliance's digital unit Jio Platforms attracted not just private equity and sovereign wealth funds but also Google <GOOGL.O> and Facebook <FB.O>, a strong endorsement for an enterprise that until a few years ago focussed largely on oil refining."
2020-07-15 23:46:21 -0400,"Can Ambani Take on Tencent, Huawei and Xiaomi?","(Bloomberg Opinion) -- With the $28 billion he’s raised working from home, India’s richest man wants to step into the breach created by the technology cold war between America and China. The two Silicon Valley tech giants that gave him a third of the money will help put him there. It’s an audacious plan. Politicians in many nations, including the U.S., the U.K. and India, are reluctant to let Huawei Technologies Co., which they accuse of being an instrument of the Chinese state, become embedded in the fast-speed internet networks that will run everything from power stations to autonomous cars.Ambani’s four-year-old Jio Platforms Ltd. has indigenously built its own 5G technology, the tycoon announced at Wednesday’s annual general meeting o..."
2020-07-15 17:02:00 -0400,Zoom Stock Gets a Rare Sell Rating Because the ‘Demand Surge’ Could Be Over,"If you’ve owned  (ZM) shares all year long, congratulations—the stock has nearly quadrupled.  CFRA analyst Keith Snyder on Wednesday launched coverage of the red-hot videoconferencing company with a Sell rating and a $215 target price, about $40 below the current level."
2020-07-15 14:32:15 -0400,Is TikTok a security threat? It’s complicated.,"TickTok has been called a security threat by President Trump, but the truth is more complicated than that."
2020-07-15 13:11:00 -0400,"Consumer use of fitness apps is surging among Americans, new survey results show","Video-conferencing services like Zoom Video Communications Inc.  aren't the only tech tools seeing a rise in use since the outbreak of COVID-19. Some 41% of Americans used a fitness app for the first time during quarantine and over half (56%) are so confident in their home workouts that they plan to cancel their gym memberships, according to a survey of 2,000 people from Freeletics, a provider of AI-based fitness and lifestyle coaching. The survey was conducted by OnePoll. The average American used two fitness apps and took four online fitness classes during lockdown. The exercise-at-home movement is reflected in the stock performance of leading fitness vendors. Peloton Interactive Inc.  shares have soared 119% this year, while those of F..."
2020-07-15 07:16:00 -0400,"This Growth Stock Has Doubled in 2020, and It Could Still Soar Higher",The shift toward remote working has already given tech stock Bandwidth a shot in the arm and additional boosters may be on the way.
2020-07-14 17:45:09 -0400,Zoom Video Communications Stock Sinks As Market Gains: What You Should Know,"In the latest trading session, Zoom Video Communications (ZM) closed at $260.01, marking a -0.11% move from the previous day."
2020-07-14 07:55:20 -0400,"India's Bharti Airtel, Verizon tie up on video-conferencing tool",By Sankalp Phartiyal
2020-07-14 07:48:55 -0400,"Bharti Airtel, Verizon tie up on video-conferencing tool","Bharti Airtel Ltd is partnering with Verizon Communications Inc's BlueJeans to launch a business-focused video conferencing tool, the Indian wireless carrier said on Tuesday.  Airtel BlueJeans will be free for all business customers for three months and store all of its data in India, Gopal Vittal, Bharti Airtel CEO (India and South Asia) told a virtual news conference.  ""This work from home trend and this increasing trend towards conferencing and collaborating from remote areas is only going to grow,"" Vittal said."
2020-07-13 16:58:41 -0400,"Nasdaq Sinks 227 Points as Zoom, Other Investor Favorites Reverse and Fall Hard","The Nasdaq Composite (NASDAQINDEX: ^IXIC) has had a great run, rising to record highs.  After having been up significantly for much of the day, the Composite and the Nasdaq-100 index fell almost 2%.  To be clear, not all Nasdaq stocks suffered declines."
2020-07-10 19:06:17 -0400,TikTok Gets an Amazon-Sized Scare,"(Bloomberg Opinion) -- What was a turbulent enough week for TikTok turned downright bizarre on Friday.Already, Secretary of State Mike Pompeo had warned that the Trump administration was looking at banning the short-video platform owned by Beijing-based parent ByteDance Ltd. over data-privacy concerns, and President Donald Trump himself said he was considering banning TikTok as one way to retaliate against China over the coronavirus. Then things got worse when Amazon.com Inc. on Friday sent an email to employees telling them to delete the TikTok app from mobile devices they use to access company email, citing “security risks.”The bizarre part happened just hours after that, when Amazon issued a statement saying the email it had sent to it..."
2020-07-10 10:47:02 -0400,"The Zacks Analyst Blog Highlights: California-based Fortinet, Fastly, Teladoc Health, DocuSign and Zoom Video Communications","The Zacks Analyst Blog Highlights: California-based Fortinet, Fastly, Teladoc Health, DocuSign and Zoom Video Communications"
2020-07-09 12:00:00 -0400,"Zoom, Microsoft, and Slack Just Ramped Up the Battle for Virtual Meeting Supremacy","Three of the biggest players in the virtual meeting space, Zoom Video Communications (NASDAQ: ZM), Slack Technologies (NYSE: WORK), and Microsoft (NASDAQ: MSFT) Teams, all had big product announcements this week.  The timing of these updates indicates the intensity of the competition between these leading virtual meeting providers.  The offering will make accessing Zoom Rooms and Zoom Phone easier by providing subscription options for phone and meeting room hardware to complement its Zoom videoconferencing services."
2020-07-08 15:26:00 -0400,"Slack, Microsoft, Zoom are upping the ante in virtual meeting wars","In short order, Slack made a rare acquisition, Microsoft Teams dressed up Teams service, and Zoom is getting into the hardware business."
2020-07-08 14:00:26 -0400,Microsoft Introduces Virtual ‘Theater’ Seating to Help Relieve Video Meeting Fatigue,"(Bloomberg) -- After months of staying home, almost every office worker is probably sick of virtual meetings. Microsoft Corp. said it has a few new ways to make videoconferencing more interactive and easier to figure out who’s talking, or who is trying to.New features for the company’s Teams videoconferencing software announced Wednesday include one in which participants are arranged side-by-side in white chairs seated in auditorium-style tiers. The company also developed a touch-screen display as a companion to a computer that can be used with Teams to access calendars, messages and calls. The voice-controlled devices will be made by partners like Lenovo Group Ltd. and will be available later this year.Microsoft has seen usage of Teams e..."
2020-07-08 13:37:00 -0400,"Zoom’s Latest Business Is Leasing Phones, Which Could Be Good for Poly","Morgan Stanley analyst says the segment should help the videoconferencing company, given the opportunity to “increase customer stickiness.”"
2020-07-08 08:11:12 -0400,6 Stocks to Wade Through the Spike in Coronavirus Cases,"The current health scare drives market volatility and calls for investment in consumer staples, healthcare and IT sectors for stable returns."
2020-07-08 08:00:00 -0400,Will SL Green Realty Feel the Impact of Remote Work?,"SL Green Realty (NYSE: SLG), New York City's largest commercial landlord, has seen its stock price cut in half from its highs earlier this year.  On its first-quarter earnings call, management optimistically noted that the company had collected 90% of its commercial real estate rents and 60% of its retail client rents.  Do these collection rates for real estate in New York City -- the U.S. city hit hardest so far by the pandemic -- suggest that COVID-19's expected longer-term impact on commercial real estate might be more muted?"
2020-07-08 07:22:11 -0400,5 Growth-Focused Cloud Stocks to Buy Amid Coronavirus Crisis,Here we choose five cloud-focused technology stocks that are well poised to grow amid the coronavirus crisis.
2020-07-07 19:23:51 -0400,Big Tech’s China Face-Off Risks Sparking Exodus From Hong Kong,"(Bloomberg) -- Facebook Inc., Google and Twitter Inc. -- all of which are blocked in the mainland -- are now headed toward a showdown with China that could end up making Hong Kong feel more like Beijing.Hours after Hong Kong announced sweeping new powers to police the internet on Monday night, those companies plus the likes of Microsoft Corp. and Zoom Video Communications Inc. all suspended requests for data from the Hong Kong government. ByteDance Ltd.’s TikTok, which has Chinese owners, announced it would pull its viral video app from the territory’s mobile stores in the coming days even as President Donald Trump threatened to ban it in the U.S.Their dilemma is stark: Bend to the law and infuriate Western nations increasingly at odds wi..."
