datetime,title,content
2020-10-30 15:14:00 -0400,"Why CrowdStrike, Zoom Video Communications, and ZoomInfo Technologies Just Crashed Again","This certainly hasn't been a great week to own tech stocks.  Since trading closed for the week last Friday, and through 12:40 p.m. EDT today, cybersecurity specialist CrowdStrike Holdings (NASDAQ: CRWD) is down 8%, videoconferencing company Zoom Video Communications (NASDAQ: ZM) has fallen 8.7%, and the confusingly similarly named software-as-a-service company ZoomInfo Technologies (NASDAQ: ZI) has dropped 13%.  While that may be true, the fact is that there does appear to be a reason for investors suddenly getting nervous about the stock market in general -- and high-flying tech stocks in particular -- and just like earlier this year, its name is COVID-19."
2020-10-29 17:00:14 -0400,WW CEO on earnings beat: People are 'reappraising' their health during COVID-19,WW International CEO Mindy Grossman talks with Yahoo Finance right after third quarter earnings hit the newswires.
2020-10-29 15:20:00 -0400,Nasdaq's Big Bounce Leaves These 2 Stay-at-Home Stocks Behind,"The Nasdaq Composite (NASDAQINDEX: ^IXIC) has seen its share of big drops followed by big rebounds, and Thursday was merely another instance of that phenomenon.  As of just after 2:30 p.m. EDT, the Nasdaq was up nearly 2.5%.  Shares of Peloton Interactive were down more than 5%."
2020-10-29 14:46:02 -0400,Why Zoom Video Stock Fell 6% on Thursday,Are investors in the videoconferencing specialist taking profits after the stock's massive run-up this year?
2020-10-29 06:12:00 -0400,"How Has Zoom Soared 676% This Year, but Still Costs Only $1?","Zoom Video Communications (NASDAQ: ZM) has had a very good run this year, with its share price climbing from $68.80 on Jan. 2 all the way to $528.10 near the end of October.  While there's an argument to be made that Zoom may be overvalued, rising coronavirus cases and Zoom's plans for growth (including expansion into online event hosting) suggest the stock could still be a buy.  Instead, many major brokerage firms now allow you to buy fractional shares."
2020-10-28 17:29:02 -0400,Investors Pull $33 Billion From SPY in 2020,"$33 billion has been pulled out of the world's biggest exchange traded fund, the SPDR S&P 500 ETF in 2020 even as $120 billion has flowed into the overall ETF universe."
2020-10-28 17:01:00 -0400,How to Use Options to Play a Decline in Zoom Video’s Stock,"(ZM) has been the ultimate stay-at-home stock this year, and it has burned bears during its ascent.  Shares of the provider of videoconferencing services (ticker: ZM) have soared to $516 from $68 during 2020.  For those wanting to bet that Zoom’s stock takes a hit in the coming months—perhaps on favorable news on a Covid-19 vaccine clinical trial—investors can use put option spreads to limit downside risk."
2020-10-28 13:36:00 -0400,10 Biggest Stock Losers in the Nasdaq Wednesday,"The worst stocks in the Nasdaq Wednesday include Apple, Nvidia, Regeneron, and Tesla. See which stocks performed worst Wednesday."
2020-10-27 11:16:37 -0400,Zoom Could Add to Historic Gains,"Zoom Video Communications, Inc. (ZM) stock flashed green on Monday despite the biggest down day since early September, highlighting resiliency that could translate into much higher prices in coming months.  One analyst has called it quits, telling clients to take profits and move to the sidelines."
2020-10-27 10:25:02 -0400,"The Zacks Analyst Blog Highlights: Zoom Video, Spectrum Brands, Ollie's Bargain Outlet, Grocery Outlet and Lifetime Brands","The Zacks Analyst Blog Highlights: Zoom Video, Spectrum Brands, Ollie's Bargain Outlet, Grocery Outlet and Lifetime Brands"
2020-10-27 09:41:00 -0400,Zoom Video Communications Launches Free End-to-End Encryption,"Zoom Video Communications (NASDAQ: ZM) has launched end-to-end encryption (E2EE) for both its free and paid services.  This means that, for a 30-day period, Zoom is actively soliciting user feedback for it.  As the descriptor ""end-to-end"" implies, when E2EE is in use the only users that have access to the encryption keys securing the meeting are the participants."
2020-10-26 18:03:13 -0400,David Rubenstein: People won't be 'rushing back to work' after COVID-19,"Billionaire investor and co-founder of The Carlyle Group, David Rubenstein, told Yahoo Finance that while it’s ‘an interesting phenomenon’ when trying to figure out how quickly the world has changed because of the pandemic, one thing is very clear: you’re not going to see people 'rushing back to work’ to the office in a post COVID-19 world."
2020-10-26 17:33:21 -0400,"Anne Walsh, Guggenheim CIO Fixed Income: The pandemic has shown that people can be productive working from home.","Anne Walsh, Guggenheim CIO Fixed Income, and Rob Falzon, Prudential Vice Chairman discuss how the pandemic has accelerated certain trends in the workplace, including more people working from home."
2020-10-26 14:37:46 -0400,"Tech Stocks To Watch: Track Changes To Zoom, PayPal, Alibaba And More","Zoom Video, PayPal, Alibaba, Nvidia and Microsoft are among the top tech stocks to watch as Q3 earnings season kicks into high gear."
2020-10-26 12:41:00 -0400,Why Zoom Video Stock Was Climbing Today,The videoconferencing app gained on worries about another spike in virus cases and on a software improvement.
2020-10-26 09:23:01 -0400,Coronavirus Cases Hit All-Time High: 5 Must-Buy Stocks,"Consumer discretionary and consumer staple stocks like Lifetime Brands (LCUT), Ollies Bargain Outlet Holdings (OLLI) and Spectrum Brands Holdings (SPB) have gained popularity since the coronavirus outbreak."
2020-10-26 06:30:00 -0400,These Companies Pay the Most in Stock Compensation,"Stock compensation is typically used by startups to keep cash burn at a minimum, and theoretically handsomely reward employees if there is a liquidity event such as an acquisition or initial public offering.  After an IPO, a typical tech company’s first several quarters of public life will nearly always be characterized by large losses caused by employee stock vesting, which translates to the stock compensation line item in the cash flow statement.  Equity is used by older businesses too as a means of giving employees additional compensation and retaining staff."
2020-10-24 08:00:02 -0400,Expert: Zoom both 'gift and something that's worn us all out'; here's what to do about it,"While tele-working technology is a “gift” to help the professional class stay productive, the burnout is real, according to one expert."
2020-10-23 13:05:12 -0400,"Despite the pandemic, executives are more “super excited” than ever",An analysis of analyst calls shows that executives are saying they are &quot;super excited&quot; more than ever. Particularly in tech.
2020-10-23 12:49:04 -0400,"The Zacks Analyst Blog Highlights: Nvidia, Softbank, Salesforce, Microsoft and Zoom Video","The Zacks Analyst Blog Highlights: Nvidia, Softbank, Salesforce, Microsoft and Zoom Video"
2020-10-23 11:30:03 -0400,Is Zoom Video Communications Outperforming Other Computer and Technology Stocks This Year?,Is (ZM) Outperforming Other Computer and Technology Stocks This Year?
2020-10-22 20:24:59 -0400,Cisco's Webex participants near 600 mln as pandemic flares again,"Cisco's video-conferencing app Webex clocked 590 million participants in September and is on track to record over 600 million this month, nearly double the numbers recorded in March when countries started shutting down due to the pandemic.  After offices started to close down due to COVID-19, people switched on video conferencing platforms to work from home, leading to swift growth in platforms such as Webex, Zoom Video Communications Inc and Microsoft Corp's Teams.  While the expansion in Webex user numbers started in March, it has not tapered off, and attendees are at all-time highs in October amid a resurgent pandemic, Jeetu Patel, Cisco Systems Inc's general manager for security and applications business, told Reuters."
2020-10-22 17:37:09 -0400,3 Top-Ranked Tech Stocks to Buy Now and Hold,"Let's explore three diverse, top-ranked technology stocks that longer-term investors might want to consider buying and holding despite any near-term noise and volatility..."
2020-10-22 16:47:00 -0400,"Zoom to Start Collecting Communications Taxes in California, New York","Zoom has been sending out notifications to customers in four states—California, New York, Maryland, and Virginia—to disclose that starting next month, the company will begin collecting a variety of local taxes."
2020-10-22 11:30:00 -0400,"Adding $1,000 to These 3 Top Stocks Right Now Would Be Brilliant","Just a small investment can go a long way when investing in high-flying, top-tier companies with massive addressable markets."
2020-10-22 10:45:00 -0400,Align Technology Stock Soars 33% on Blowout Earnings Report,"Adjusted earnings per share for the maker of Invisalign clear tooth aligners came in at $2.25, well above the 64 cents analysts expected."
2020-10-22 10:00:00 -0400,These Stocks Would Have Doubled Your Money Over the Past Year,"Zoom (NASDAQ: ZM), Shopify (NYSE: SHOP), and Peloton (NASDAQ: PTON) are all emerging as powerhouses in their respective businesses, a big reason these growth stocks have all more than doubled in the past year.  The company is enabling small businesses to build brands, rather than squashing or controlling them, allowing innovation from others to drive growth."
2020-10-21 15:11:00 -0400,Is Zoom Video Turning Lower?,"Zoom Video Communications  has soared since February when the pandemic was just starting to change our lives.  When financial analysts talk and write about 2020 they will undoubtedly mention Zoom.  In this daily bar chart of ZM, below, we can see some ""issues"" with the price picture and the indicators."
2020-10-21 08:24:00 -0400,Is Zoom Stock Overvalued?,The stock price reached all-time highs after the company revealed new features and products during its Zoomtopia user conference.
2020-10-20 13:32:05 -0400,Intel to Divest NAND Memory Business: Key Takeaways,"Intel (INTC) inks agreement with SK hynix to sell its NAND operations for $9 billion and use the proceeds to strengthen its presence in the AI, 5G networking and edge computing markets."
2020-10-20 07:30:00 -0400,Shocking: Zoom Video Is Almost as Big as the Tech Giant That Spurned It,"2020 has certainly been the year of Zoom Video Communications.  As the coronavirus pandemic upended the lives of both businesses and consumers worldwide, Zoom Video became a preferred method of communication.  If CEO Eric Yuan doesn't win Fortune magazine's CEO of the year, it would be a big surprise."
2020-10-14 17:48:37 -0400,"Zoom Wants to Partner With, Not Defeat, Slack and Microsoft","(Bloomberg) -- Zoom Video Communications Inc. Chief Executive Officer Eric Yuan said the company will do a better job integrating office chatroom products from Slack Technologies Inc. and Microsoft Corp., betting that cooperation is better than competition for the software maker’s growth.“Chat is a very important functionality for our overall usage,” Yuan said Wednesday during an online meeting with analysts. “The core priority is how to further improve the integration between chat, video and voice.”Customers are satisfied with Zoom’s current chat sidebar during videoconferences and the company isn’t interested in chasing Slack and Microsoft Teams by delving further into the market, he added.“We really integrate very well with Slack, with..."
2020-10-12 17:45:09 -0400,Zoom Video Communications Stock Sinks As Market Gains: What You Should Know,"Zoom Video Communications (ZM) closed the most recent trading day at $491.54, moving -0.18% from the previous trading session."
2020-10-11 08:15:00 -0400,2 Stay-at-Home Tech Stocks to Buy Right Now,A socially distant world brought phenomenal growth to these companies. But they're not finished growing yet.
2020-09-28 07:00:00 -0400,Should You Buy These High-Flying Nasdaq Stocks?,"A handful of Nasdaq-listed names have bucked the bigger bearish trend, but for coronavirus-related reasons that won't abate anytime soon."
2020-09-25 17:40:00 -0400,Stay-at-Home Stocks Send Markets Soaring Friday,"The stock market has been looking for a strong recovery, and on Friday, it finally got one.  For small businesses that had to shut down their brick-and-mortar retail presence entirely, Shopify has been a lifesaver."
2020-09-24 14:26:00 -0400,Why DocuSign and Zoom Video Stocks Are Down Today -- but BlackBerry Stock Is Up,"It's looking like an up-and-down day for tech stocks Thursday, with shares of DocuSign (NASDAQ: DOCU) and Zoom Video Communications (NASDAQ: ZM) -- two equities that have fairly thrived in the coronavirus economy -- giving back some gains and falling today.  As of 11:30 a.m. EDT, DocuSign stock is down 3.4% and Zoom Video shares are off 6.5%.  In contrast, though, shares of former smart-phone-making star BlackBerry (NYSE: BB) are flying -- up 7.1%."
2020-09-23 16:38:00 -0400,Tesla Disappoints as Nasdaq Falls; Why Zoom's Still Climbing,"The stock market can't seem to decide which way to go, and that's made September a bumpy month for the Nasdaq Composite (NASDAQINDEX: ^IXIC).  Many investors had hoped that Tesla (NASDAQ: TSLA) might be able to spur another rally in the Nasdaq on Wednesday, with its Battery Day event having occurred late Tuesday afternoon.  Tesla shares were down another 10% on Wednesday, adding to losses from Tuesday's session."
2020-09-23 12:48:04 -0400,"The Zacks Analyst Blog Highlights: ZM, PENN, TPR and ZG","The Zacks Analyst Blog Highlights: ZM, PENN, TPR and ZG"
2020-09-23 11:50:00 -0400,3 Hot Stocks Growing Faster Than Snowflake Right Now,This month's top IPO grew revenue at a blistering 121% rate in its latest quarter. Let's meet three market stars that are growing even faster.
2020-09-23 09:14:01 -0400,4 Growth Stocks to Buy as Nasdaq Stages Comeback,Here we pick four stocks that trade on Nasdaq and are positioned to grow on solid prospects.
2020-09-23 06:44:00 -0400,3 Stocks to Buy if the Coronavirus Vaccine Race Disappoints,There's a possibility we may not get a coronavirus vaccine through clinical trials. Here are three stocks to buy in case that happens.
2020-09-22 19:07:00 -0400,Why Zoom Stock Jumped Today,"What happened Shares of Zoom Video Communications (NASDAQ: ZM) climbed 5.2% on Tuesday as COVID-19 continues to spread around the world at an alarming rate. So what Nearly 7 million Americans have contracted the dangerous disease, and more than 200,000 have died."
2020-09-22 11:25:00 -0400,3 Top Stocks To Watch This Year,"Shares of Peloton Interactive (NASDAQ: PTON), Zoom Video Communications (NASDAQ: ZM), and DocuSign (NASDAQ: DOCU) have made early believers a lot of money this year, but the party could just be getting started.  Peloton, Zoom, and DocuSign have all more than doubled this year."
2020-09-21 09:00:01 -0400,5 FAANG-Beaters to Buy Right Now for Better Returns,Here we pick five stocks that have outperformed FAANGs and are well-poised to grow driven by solid fundamentals and gradual economic recovery.
2020-09-20 04:31:59 -0400,Oracle Boosts Cloud Ambitions With Help From TikTok and Trump,"(Bloomberg) -- Oracle Corp.’s deal to attain a 12.5% stake in TikTok Global and provide computing services to the video-sharing app furthers the software maker’s years-long plan to become a cloud computing heavyweight.Executive Chairman Larry Ellison leaned on his company’s close ties to the Trump administration to land the partnership with the newly formed company, which will help fulfill an ambitious strategy outlined with fanfare half a decade ago to become a credible cloud rival to Amazon.com Inc. and Microsoft Corp.Retailer Walmart Inc. will buy as much as 7.5% of TikTok Global, which will be headquartered in the U.S. and pursue a public listing in less than a year, the companies announced Saturday in a statement.While other Silicon ..."
2020-09-18 17:47:11 -0400,"Stock Markets Fall, but These 4 Winners Keep on Winning","Friday was an ugly day for the stock market. The Nasdaq Composite (NASDAQINDEX: ^IXIC) dove during the middle of the trading day, and it took a sizable rebound for it to finish the day down just 1%. Similar-sized declines ruled the day for the Dow Jones Industrial Average (DJINDICES: ^DJI) and S&P 500 (SNPINDEX: ^GSPC)."
2020-09-18 10:20:02 -0400,"The Zacks Analyst Blog Highlights: Novartis, Zoom Video, Caterpillar, Microsoft, Cisco, Clorox and LHC Group","The Zacks Analyst Blog Highlights: Novartis, Zoom Video, Caterpillar, Microsoft, Cisco, Clorox and LHC Group"
2020-09-17 15:06:00 -0400,Why Zoom Stock Fell Today,"Shares of Zoom Video Communications (NASDAQ: ZM) fell by as much as 5.2% today, as investors cooled to some market sectors, including tech stocks.  The company's share price slide was in line with a broader market dip today, with the S&P 500 down 1.4% in afternoon trading.  Zoom's stock had regained most of the losses by the afternoon, and the company's share price was down less than 1% as of 2:50 p.m. EDT."
2020-09-17 11:24:00 -0400,"A Deep Dive Into ZoomInfo -- the Other Cool ""Zoom"" Company","Its platform is a great tool for helping salespeople reach the real decision-makers at companies, but is its stock a really great investment?"
2020-09-17 03:19:17 -0400,Tech Craze Puts IPO on Path to Best India Debut in Nearly a Year,"(Bloomberg) -- Happiest Minds Technologies Ltd. more than doubled on the first day of trading after the technology company last week closed one of India’s most successful initial share sales of this decade.Demand exceeded shares on offer by 151 times as retail investors piled into a company that gets almost all its revenue from digital services. The founder and Chief Executive Officer Ashok Soota’s storied career in the technology industry, including the IPO of Mindtree Inc., also helped drum up interest for nine-year-old Happiest Minds.The Bengaluru-based company’s stock began trading at 351 rupees versus an offer price of 166 rupees, and climbed as high as 395 rupees in early trade. The debut is the best since October, when state-owned ..."
2020-09-16 09:30:00 -0400,Google Is Getting Into Video-Calling Hardware,The search giant is partnering with Lenovo to release new videoconferencing kits for the enterprise.
2020-09-16 08:40:12 -0400,"Zoom Video's Shares March Higher, Can It Continue?","As of late, it has definitely been a great time to be an investor Zoom Video."
2020-09-16 06:16:00 -0400,The One Lesson to Make You Great at Investing -- and Life,"Ask them why they didn't put their entire portfolio into Zoom Video Communications (NASDAQ: ZM) back then.  The uncomfortable truth is this: The future is unknowable.  After hearing a number of investors I highly respect talk about Zoom, I decided to kick the tires."
2020-09-15 06:21:00 -0400,3 Reasons Zoom Video Communications Stock Still Looks Like a Long-Term Winner,"Zoom Video Communications (NASDAQ: ZM) has been one of the biggest winners during the coronavirus pandemic.  The stock is up nearly 500% year to date as the videoconferencing specialist has delivered a pair of blowout earnings reports with revenue skyrocketing 355% in the second quarter.  Businesses, non-profits, schools, and everyday consumers have embraced the videoconferencing platform, which has become an essential utility during the crisis."
2020-09-13 06:08:00 -0400,3 Best Coronavirus Stocks to Watch in September,The momentum is not yet over for these three promising companies that are doing their part in combating the COVID-19 pandemic.
2020-09-12 08:00:00 -0400,Corset Maker’s Advice to Other Small Business Owners During the Pandemic: Constantly Stay in Touch With Your Customers,"Dark Garden saw a glimmer of its former vibrant self over Labor Day weekend, thanks to a citywide initiative to help revive small businesses during the pandemic. The program seeks to create a safer space for walking, dining and shopping in San Francisco."
2020-09-11 12:45:08 -0400,Oracle Highlights Zoom Video as Top Cloud Computing Customer,The database giant crushed Wall Street's targets in Q1 and expects further growth in the next period.
2020-09-11 08:25:00 -0400,"Forget Tesla, Buy These 3 High-Growth Tech Stocks Instead","Despite its share-price slide earlier this week, Tesla's (NASDAQ: TSLA) stock has been on a tear this year.  To help you find a few, we asked three Motley Fool contributors for their top picks right now, and they came back with MongoDB (NASDAQ: MDB), Zoom Video Communications (NASDAQ: ZM), and Square (NYSE: SQ).  Brian Withers (MongoDB): Gasoline-fueled engines have been the primary way cars have generated power since Ford's Model-T in the early 1900s, but Tesla is changing that."
2020-09-10 08:30:00 -0400,Millions of Users Love Zoom: Here's Why That's Bad News,"With work-from-home and social distancing policies increasing reliance on video conferencing applications, Zoom Video Communications (NASDAQ: ZM) has posted record-breaking growth.  The company stated that it is working toward an end-to-end encryption add-on feature, but for a Zoom meeting to be end-to-end encrypted, the video and audio content would need to be encrypted in such a way that only the participants in the meeting have the ability to decrypt it."
2020-09-10 08:00:00 -0400,6 Reasons This Tech Bubble Is Bursting,"Zoom Video Communications (NASDAQ: ZM) became a household name, Shopify (NYSE: SHOP) has exploded onto the scene, and names like Tesla (NASDAQ: TSLA), Square (NYSE: SQ), and Wayfair (NYSE: W) have all seen their stock prices at least double this year.  Food delivery services, video conferencing, and online retail are just a few of the tech companies that have grown more than expected in 2020."
2020-09-09 18:13:00 -0400,Nautilus Stock Trades Higher After Research Firm Points to Zoom-Like Growth,"Shares of home fitness company Nautilus (NYSE: NLS) traded 8% higher on Wednesday, after research firm Citron Research said the company was ""the fastest growing name"" besides Zoom Video Communications.  Given the firm's prominence and Zoom's parabolic growth in 2020, that statement caught investors' eyes.  The reason is the at-home fitness trend, but also that Peloton's products are on backorder."
2020-09-09 15:46:00 -0400,What's Next for Pandemic Necessity Zoom Video?,"In the daily Japanese candlestick chart of ZM, below, we can see an unorthodox falling three methods pattern.  In the weekly candlestick chart of ZM, below, we get a much different picture.  In this daily Point and Figure chart of ZM, below, we can see that the stock reached a target of $420."
2020-09-09 12:20:04 -0400,Will Zoom Video Gain on Rising Earnings Estimates?,"Zoom Video (ZM) shares have started gaining and might continue moving higher in the near term, as indicated by solid earnings estimate revisions."
2020-09-09 11:18:00 -0400,Shark Bites: I'm Signing In to Zoom Video Again,"I&apos;m bringing bringing ""Shark Bites"" back to Real Money. These are fast-moving trades that are developing strong chart patterns. Our first bite is Zoom Video Communications , which provides a cloud-based platform that allows face-to-face video interactions."
2020-09-09 09:03:24 -0400,"Industry Analysts Just Upgraded Their Zoom Video Communications, Inc. Revenue Forecasts By 32%","Zoom Video Communications, Inc. (NASDAQ:ZM) shareholders will have a reason to smile today, with the analysts making..."
2020-09-08 13:52:00 -0400,Why DocuSign and Zoom Video Stocks Sank Today -- but CrowdStrike Bounced,"Last week's tech sell-off picked up where it left off on Tuesday, with DocuSign (NASDAQ: DOCU), CrowdStrike Holdings (NASDAQ: CRWD), and Zoom Video Communications (NASDAQ: ZM) resuming their respective declines.  All three stocks tumbled more than 5% early this morning, and DocuSign shares remain down 2.7% as of 12:05 p.m. EDT, while Zoom is down 2.8%.  Shares of DocuSign and Zoom Video are up 260% and 360%, respectively, over the past year."
2020-09-08 13:22:05 -0400,"Zoom Video, CAR, TGT, YETI and WSM as Zacks Bull and Bear of the Day","Zoom Video, CAR, TGT, YETI and WSM as Zacks Bull and Bear of the Day"
2020-09-08 05:28:57 -0400,"In-house counsel on the move: Robinhood swipes compliance heads from Fidelity, Wells","The commission-free trading startup said in an Aug. 27 blog post that Norm Ashkenas is joining the company as chief compliance officer for Robinhood Financial, and Kelly Zigaitis will be chief compliance officer of Robinhood Securities.  Ashkenas led compliance for units of mutual fund giant Fidelity Investments, and Zigaitis was the former head of oversight and controls for Wells Fargo Advisors."
2020-09-07 09:28:01 -0400,5 Shelter-in-Place Stocks to Buy as Coronavirus Cases Rise,"Shelter-in-place stocks have been rallying since the coronavirus outbreak, with the majority outperforming the broader market."
2020-09-06 09:45:00 -0400,"If You've Got $3,000 to Invest, These 3 Top Stocks Just Grew Revenue by More Than 100%","As the undisputed leader in Latin American e-commerce, MercadoLibre (NASDAQ: MELI) was well-positioned to serve the needs of online shoppers in the region.  Both e-commerce and digital payments have seen blockbuster adoption during the pandemic, significantly boosting MercadoLibre's results.  This was driven by commerce revenue that grew 149%, while fintech revenue grew 86%."
2020-09-05 14:00:00 -0400,Better Buy: Zoom Video Communications vs. Cisco Systems,"Zoom Video Communications (NASDAQ: ZM) probably wouldn't exist without Cisco Systems (NASDAQ: CSCO).  Zoom's founder and CEO Eric Yuan was previously one of the first employees at Webex, the video conferencing start-up Cisco acquired in 2007.  Yuan subsequently became Cisco's VP of Engineering, and pitched the idea of a new smartphone-oriented video conferencing platform to the company in 2011."
