datetime,title,content
2020-06-10 18:31:23 -0400,Zoom Reactivates Account of Chinese Pro-Democracy Activists,"(Bloomberg) -- Zoom Video Communications Inc. said it reactivated the account of a U.S.-based group of Chinese pro-democracy activists, after earlier closing the account “to comply with local laws.”The San Jose, California-based company suspended the group’s user credentials after it hosted a recent gathering to commemorate the 1989 protests and massacre at Tiananmen Square, a seminal event for advocates of democracy in China. Zoom’s decision to close the account was reported earlier by Axios.“Just like any global company, we must comply with applicable laws in the jurisdictions where we operate,” a Zoom spokesman said in a statement. “When a meeting is held across different countries, the participants within those countries are required ..."
2020-06-10 18:17:04 -0400,"Zoom shut down U.S. activists' account after Tiananmen commemoration, citing Chinese law","Zoom, the videoconferencing technology company, says it has reactivated the account of U.S.-based activists who hosted an event commemorating the 1990 Tiananmen Square massacre."
2020-06-09 18:45:00 -0400,"ZOOM ALERT: Bragar Eagel & Squire, P.C. is Investigating Zoom Video Communications. Inc. on Behalf of Long-Term Stockholders and Encourages Investors to Contact the Firm","Bragar Eagel & Squire, P.C., a nationally recognized shareholder rights law firm, is investigating potential claims against Zoom Video Communications, Inc. (NASDAQ: ZM) on behalf of long-term stockholders. Our investigation concerns whether the board of directors of Zoom have breached their fiduciary duties to the company."
2020-06-09 11:40:00 -0400,The Most Absurd Earnings Beat,"In this episode of Industry Focus: Tech, Dylan Lewis is joined by Motley Fool contributor Brian Feroldi to take a deep dive into Zoom Video Communications (NASDAQ: ZM).  Discover what is attracting people to Zoom and what's keeping them there.  To catch full episodes of all The Motley Fool's free podcasts, check out our podcast center."
2020-06-09 09:39:01 -0400,"Zoom Video, Hewlett Packard Enterprise, Apple and Broadcom highlighted as Zacks Bull and Bear of the Day","Zoom Video, Hewlett Packard Enterprise, Apple and Broadcom highlighted as Zacks Bull and Bear of the Day"
2020-06-09 08:52:00 -0400,Surprising Jobs Numbers and an Interview With Shopify CEO Tobi Lutke,"In this podcast, we've got a look at news about jobs and companies including Zoom Video (NASDAQ: ZM), Slack (NYSE: WORK), DocuSign (NASDAQ: DOCU), Dick's Sporting Goods (NYSE: DKS), eBay (NASDAQ: EBAY), and Levi Strauss (NYSE: LEVI).  To catch full episodes of all The Motley Fool's free podcasts, check out our podcast center."
2020-06-09 07:15:00 -0400,3 Coronavirus-Proof Tech Stocks to Buy Right Now,The coronavirus pandemic is far from over. But here are three companies that can thrive in these difficult times.
2020-06-08 12:06:00 -0400,3 Coronavirus Winners That Will Keep Moving Higher,"Zoom Video, Peloton, and Teladoc have had a great 2020, and they will continue to thrive beyond the shelter-in-place phase of this pandemic."
2020-06-07 22:50:00 -0400,"ZOOM VIDEO 24 HOUR DEADLINE ALERT: FORMER LOUISIANA ATTORNEY GENERAL AND KAHN SWICK & FOTI, LLC REMIND INVESTORS WITH LOSSES IN EXCESS OF $100,000 of Deadline in Class Action Lawsuit Against Zoom Video Communications, Inc. - ZM","Kahn Swick & Foti, LLC (""KSF"") and KSF partner, the former Attorney General of Louisiana, Charles C. Foti, Jr., remind investors that they have only until June 8, 2020 to file lead plaintiff applications in a securities class action lawsuit against Zoom Video Communications, Inc. (NasdaqGS: ZM), if they purchased the Company's securities between April 18, 2019 and April 6, 2020, inclusive (the ""Class Period""). This action is pending in the United States District Court for the Northern District of California."
2020-06-07 12:00:00 -0400,"ZM APPROACHING DEADLINE: Bronstein, Gewirtz & Grossman, LLC Reminds Zoom Video Communications, Inc. Short Sellers, Long and Derivative Investors of Class Action and Lead Plaintiff Deadline: June 8, 2020","New York, New York--(Newsfile Corp. - June 7, 2020) - Bronstein, Gewirtz & Grossman, LLC reminds investors that a class action lawsuit has been filed against Zoom Video Communications, Inc. (NASDAQ: ZM) (""Zoom"" or ""the Company"") on behalf of shareholders who purchased Zoom securities between April 18, 2019 and April 6, 2020, inclusive (the ''Class Period''). Such investors are encouraged to join this case by visiting the firm's site: www.bgandg.com/zm. ..."
2020-06-07 09:30:00 -0400,Take Zoom’s Amazing Free Cash Flow With a Grain of Salt,"Few companies have benefited from the pandemic-driven lockdowns around the world more than Zoom Video Communications (NASDAQ: ZM).  Employers have turned to Zoom's video conferencing tech as working from home became the norm, and consumers have been using Zoom to keep in touch with friends and family.  In Zoom's first quarter, which ended on April 30, the numbers told the story of Zoom's success."
2020-06-07 08:00:00 -0400,"DEADLINE TOMORROW: The Schall Law Firm Announces the Filing of a Class Action Lawsuit Against Zoom Video Communications, Inc. and Encourages Investors with Losses in Excess of $100,000 to Contact the Firm","Los Angeles, California--(Newsfile Corp. - June 7, 2020) - The Schall Law Firm, a national shareholder rights litigation firm, announces the filing of a class action lawsuit against Zoom Video Communications, Inc. (NASDAQ: ZM) (""Zoom"" or ""the Company"") for violations of §§10(b) and 20(a) of the Securities Exchange Act of 1934 and Rule 10b-5 promulgated thereunder by the U.S. Securities and Exchange Commission.Investors who purchased the Company's securities between April 18, 2019 and April 6, ..."
2020-06-06 22:50:00 -0400,"ZOOM VIDEO 48 HOUR DEADLINE ALERT: Claimsfiler Reminds Investors With Losses in Excess of $100,000 of Deadline in Class Action Lawsuit Against Zoom Video Communications, Inc. - ZM","ClaimsFiler, a FREE shareholder information service, reminds investors that they have only until June 8, 2020 to file lead plaintiff applications in a securities class action lawsuit against Zoom Video Communications, Inc. (NasdaqGS: ZM), if they purchased the Company’s securities between April 18, 2019 and April 6, 2020, inclusive (the ""Class Period""). This action is pending in the United States District Court for the Northern District of California."
2020-06-06 12:00:00 -0400,"MONDAY DEADLINE ALERT: Bragar Eagel & Squire, P.C. Reminds Investors That a Class Action Lawsuit Has Been Filed Against Zoom Video Communications, Inc. and Encourages Investors to Contact the Firm","Bragar Eagel & Squire, P.C., a nationally recognized shareholder rights law firm, reminds investors that a class action lawsuit has been filed in the United States District Court for the Northern District of California on behalf of investors that purchased Zoom Video Communications, Inc. (NASDAQ: ZM) securities between April 18, 2019 and April 6, 2020 (the ""Class Period""). Investors have until June 8, 2020 to apply to the Court to be appointed as lead plaintiff in the lawsuit."
2020-06-06 10:00:00 -0400,Consider This Before You Balk at Zoom Video's Sky-High Valuation,"If you followed the goings-on at Zoom Video Communications (NASDAQ: ZM) during the coronavirus crisis, it seemed that it was far from firing on all cylinders.  The problem, according to detractors, is that the absurd rate of revenue growth is now more than priced in as Zoom's price-to-sales ratio (market cap divided by trailing-12-month revenue) is at a crazy 71.8."
2020-06-06 09:11:54 -0400,What's next for office tech as Americans return to work,"Fueled by increased demand for its notebooks from the current stay-at-home environment, tech giant Dell’s (DELL) Q1 earnings topped expectations, while video conferencing software like (ZM) and Cisco’s (CSCO) WebEx have also seen a dramatic increase due to the COVID-19 pandemic. However, principal analyst of Futurum Research Daniel Newman joined Yahoo Finance to discuss what’s next for Dell and other tech companies as the nation starts to return to work following the pandemic."
2020-06-05 22:50:00 -0400,"ZOOM VIDEO 72 HOUR DEADLINE ALERT: Former Louisiana Attorney General and Kahn Swick & Foti, LLC Remind Investors With Losses in Excess of $100,000 of Deadline in Class Action Lawsuit Against Zoom Video Communications, Inc. - ZM","Kahn Swick & Foti, LLC (""KSF"") and KSF partner, the former Attorney General of Louisiana, Charles C. Foti, Jr., remind investors that they have only until June 8, 2020 to file lead plaintiff applications in a securities class action lawsuit against Zoom Video Communications, Inc. (NasdaqGS: ZM), if they purchased the Company’s securities between April 18, 2019 and April 6, 2020, inclusive (the ""Class Period""). This action is pending in the United States District Court for the Northern District of California."
2020-06-05 14:00:00 -0400,"ZM LOOMING DEADLINE: Bronstein, Gewirtz & Grossman, LLC Reminds Zoom Video Communications, Inc. Short Sellers, Long and Derivative Investors of Class Action and Lead Plaintiff Deadline: June 8, 2020","New York, New York--(Newsfile Corp. - June 5, 2020) - Bronstein, Gewirtz & Grossman, LLC reminds investors that a class action lawsuit has been filed against Zoom Video Communications, Inc. (NASDAQ: ZM) (""Zoom"" or ""the Company"") on behalf of shareholders who purchased Zoom securities between April 18, 2019 and April 6, 2020, inclusive (the ''Class Period''). Such investors are encouraged to join this case by visiting the firm's site: www.bgandg.com/zm. ..."
2020-06-05 13:17:00 -0400,Slack Stock Tumbles After Earnings Because Not Every Stay-at-Home Stock Can Be Zoom,"The slide reflects an assortment of worries weighing on the stock, as well as a tough comparison with another work-at-home darling, Zoom Video Communications."
2020-06-05 13:01:00 -0400,[video]Why Investing in Slack Still WORKs,"Zoom Video Communications  gave investors and Wall Street one of those earnings announcements plus guidance that you rarely see.  During the first quarter, Zoom grew revenue 169% year over year, posted a bottom-line profit more than double expectations, and top-line revenue 62% above expectations!  Revenue guidance for both the second quarter and full-year 2021 essentially doubled from previous consensus."
2020-06-05 12:19:15 -0400,Zoom in 'early stages' of security deal with Google: CFO,Zoom continues to focus greatly on improving the security of its platform amid a surge in new users.
2020-06-05 11:07:00 -0400,"SHAREHOLDER ALERT: Levi & Korsinsky, LLP Notifies Shareholders of Zoom Video Communications, Inc. of a Class Action Lawsuit and a Lead Plaintiff Deadline of June 8, 2020 - ZM","New York, New York--(Newsfile Corp. - June 5, 2020) - The following statement is being issued by Levi & Korsinsky, LLP:To: All persons or entities who purchased or otherwise acquired securities of Zoom Video Communications, Inc. (NASDAQ: ZM) (""Zoom"") between April 18, 2019 and April 6, 2020. You are hereby notified that a securities class action lawsuit has been commenced in the the United States District Court for the Northern District of California. To get more ..."
2020-06-05 08:01:00 -0400,"Zoom Management Talks Soaring Demand, Zoom Phone, and More","Many investors are likely still digesting the implications of Zoom Video Communications' (NASDAQ: ZM) incredible fiscal first quarter.  To better understand the growth stock's momentum and management's view for Zoom's growth opportunities, here's a look at some of the commentary from Zoom leadership during the videoconferencing company's fiscal first-quarter earnings call.  As workers and consumers sheltered at home during the coronavirus pandemic, organizations turned to Zoom for video-based interaction and collaboration."
2020-06-05 07:27:00 -0400,Why Box Stock Was Up 24% in May,"Investors expected Box to be a big beneficiary of a growing mobile workforce, but first-quarter results sent mixed signals."
2020-06-05 04:57:00 -0400,‘Sticking to social distancing rules is incredibly difficult:’ The perils of navigating a world with coronavirus as a blind person,"Sarah Stephenson-Hunter, who works at the University of Oxford advising disabled staff, writes about her worries returning to work."
2020-06-04 21:54:00 -0400,"Slack was judged by Zoom standards, and it didn’t end well","After Zoom Video reported one of the most spectacular quarters in enterprise software history, investors expected a lot from Slack Technologies Inc. Too much, it turns out."
2020-06-04 16:49:06 -0400,Slack Falls After Withdrawing Billings Forecast on Uncertainty,"(Bloomberg) -- Slack Technologies Inc. withdrew its annual billings forecast, citing business uncertainty, signaling the company isn’t confident it will benefit as much from the work-from-home era as investors expect. Shares fell 16% in extended trading.Revenue will be $855 million to $870 million in the fiscal year, the San Francisco-based company said Thursday in a statement. That’s only slightly up from Slack’s annual sales projection in mid-March with a midpoint of $852 million. Analysts, on average, estimated $856.5 million, according to data compiled by Bloomberg.Slack reported sales gained 50% to $201.7 million in the period ended April 30, topping analysts’ estimates of $187 million. The company’s loss of 2 cents a share, excludin..."
2020-06-04 09:52:00 -0400,Widening Acceptance of Zoom Video Should Propel the Stock Further on the Upside,"During Wednesday night's Mad Money program, Jim Cramer presented his thoughts on Zoom Video Communications  .  What should investors make of the meteoric rise of ZM?  Zoom saw revenue explode higher by 169% and the company beat its own guidance by 64%."
2020-06-04 08:40:09 -0400,Zoom Doubles Its Full-Year Guidance on Blockbuster Earnings Results,"Zoom Video Communications (NASDAQ: ZM) has been one of the biggest stock gainers of 2020 -- it was up more than 200% year to date going into its fiscal 2021 first-quarter earnings report late Tuesday, with a serious amount of future growth built into its stock price.  It isn't just the financial metrics that illustrated the accelerating adoption Zoom experienced during the quarter -- the customer metrics were equally impressive.  The company cited both the acquisition of new customers and expansion across its existing customer base as helping drive its robust revenue growth."
2020-06-04 06:01:00 -0400,Zoom Stock Keeps Skyrocketing Higher,"Shares of videoconferencing company Zoom Video Communications (NASDAQ: ZM) jumped higher on Wednesday, climbing about 8%.  Zoom stock's gain on Wednesday came after the company's fiscal first-quarter report, which featured financials that obliterated analysts' estimates.  Here's a closer look at the incredible momentum in Zoom's business and what exactly is driving this growth stock higher."
2020-06-03 19:01:00 -0400,Jim Cramer: Zoom Video's Time Has Come,"How do you value a stock like Zoom Video , one where the total revenue growth is 169% and guidance is beaten by 64%. How do you put a price on a company that raised its annual guidance from $910 million to $1."
2020-06-03 17:41:37 -0400,Zoom’s Pledge to Work with Law Enforcement Spurs Online Blowback,"(Bloomberg) -- Zoom’s Chief Executive Officer Eric Yuan’s comments that the software company would work with law enforcement by not encrypting free calls using the popular video-conferencing service hit a nerve with some users, drawing criticism amid nationwide protests about the role of police in the U.S.Yuan, on a conference call Tuesday, said Zoom Video Communications Inc.’s efforts to provide the highest standard of digital security, called end-to-end encryption, would go to paying customers rather than the millions of people who use the app without charge for yoga classes, weddings, religious services and other social and business gatherings.“Free users, for sure, we don’t want to give that because we also want to work together with ..."
2020-06-03 16:16:59 -0400,ZoomInfo Poised to Raise $935 Million in U.S. IPO,"(Bloomberg) -- ZoomInfo Technologies Inc., the business-intelligence platform, is set to raise about $935 million in a U.S. initial public offering, pricing its shares above a targeted range, according to people with knowledge of the matter.The Vancouver, Washington-based company on Wednesday is pricing 44.5 million shares at $21 each, said the people, who asked not to be identified because the information wasn’t public yet. The shares were marketed for $19 to $20 each, a range that had been increased from $16 to $18.A representative for ZoomInfo declined to comment.The listing is part of a global IPO surge that could raise a total of more than $6 billion this week, according to data compiled by Bloomberg. Warner Music Group Inc. shares j..."
2020-06-03 16:05:00 -0400,"ZM ALERT: The Klein Law Firm Announces a Lead Plaintiff Deadline of June 8, 2020 in the Class Action Filed on Behalf of Zoom Video Communications, Inc. Limited Shareholders","New York, New York--(Newsfile Corp. - June 3, 2020) - The Klein Law Firm announces that a class action complaint has been filed on behalf of shareholders of Zoom Video Communications, Inc. (NASDAQ: ZM) alleging that the Company violated federal securities laws.Class Period: April 18, 2019 and April 6, 2020Lead Plaintiff Deadline: June 8, 2020Learn more about your recoverable losses in DNK:http://www.kleinstocklaw.com/pslra-1/zoom-video-communications-inc-loss-submission-form?id=7121&from=5The filed complaint alleges that Zoom Video Communications, Inc. made materially false ..."
2020-06-03 15:09:31 -0400,Zoom’s valuation has entered ‘uncharted territory:' Analyst,"Video conferencing giant Zoom delivered a blow-out first quarter, but the stock’s “valuation is hard to justify”, warns Dan Romanoff, analyst at Morningstar."
2020-06-03 15:05:00 -0400,Axos Financial: A Deep Dive Into the Innovative Online Bank,"In this week's episode of Industry Focus: Financials, host Jason Moser and Fool.com contributor Matt Frankel, CFP, take a deep dive into Axos Financial (NYSE: AX), an online-based banking institution that offers checking and savings accounts, mortgages, auto loans, and more.  The pair discuss what makes Axos' business model unique compared to other online banks and what investors should know about the risk factors involved.  Plus, Frankel discusses why net-lease REIT STORE Capital (NYSE: STOR) is on his radar now, and Moser talks about what he'll be watching when Zoom (NASDAQ: ZM) reports earnings."
2020-06-03 15:00:00 -0400,"DEADLINE ALERT: Bragar Eagel & Squire, P.C. Reminds Investors That a Class Action Lawsuit Has Been Filed Against Zoom Video Communications, Inc. and Encourages Investors to Contact the Firm","Bragar Eagel & Squire, P.C., a nationally recognized shareholder rights law firm, reminds investors that a class action lawsuit has been filed in the United States District Court for the Northern District of California on behalf of investors that purchased Zoom Video Communications, Inc. (NASDAQ: ZM) securities between April 18, 2019 and April 6, 2020 (the ""Class Period""). Investors have until June 8, 2020 to apply to the Court to be appointed as lead plaintiff in the lawsuit."
2020-06-03 14:40:55 -0400,Zoom earnings skyrocket as use booms amid coronavirus,Rosenblatt Securities Managing Director & Senior Analyst Ryan Koontz joins Yahoo Finance’s Zack Guzman to break down Zoom's latest earnings report.
2020-06-03 13:58:57 -0400,"News Flash: Analysts Just Made An Incredible Upgrade To Their Zoom Video Communications, Inc. Forecasts","Zoom Video Communications, Inc. (NASDAQ:ZM) shareholders will have a reason to smile today, with the analysts making..."
2020-06-03 13:47:00 -0400,"Zoom Scores Multiple Upgrades After Having ""One of the Best Quarters in Software History""","Zoom Video Communications (NASDAQ: ZM) got a boost today as multiple analysts upgraded their ratings on the stock and increased their price targets in the wake of the company's blockbuster earnings report on Tuesday.  Davidson analyst Rishi Jaluria upgraded Zoom stock to buy from neutral (hold), increasing his price target to $240, up from $150.  In a note to clients titled, ""One of the Best Quarters in Software History,"" Jaluria cited ""irreversible changes"" in the work environment going forward."
2020-06-03 13:28:51 -0400,"Pandemics, protests and an 'amoral' rally: Why Wall Street yawns in the face of chaos",The current price action is less of an indictment on the morality of investors and more of a calculated gamble that the economy is poised to rebound as lockdowns end.
2020-06-03 12:57:09 -0400,Charts Suggest Innovative Tech Stocks Are Headed Higher,Innovative tech companies are providing products and services to help navigate a new way of working and staying in touch.
2020-06-03 12:17:00 -0400,Zoom stock surges 6% to record as videoconference company post ‘most impressive’ results in ‘enterprise software history’,Zoom Video Communications Inc. gain a new crop of believers Wednesday after the videoconference company’s first-quarter results came in far ahead of expectations.
2020-06-03 12:03:00 -0400,Slack stock rallies toward new all-time closing high,"Slack Technologies Inc. shares  are up 2.2% in Wednesday trading and on track for a new all-time closing high if the gains hold through the close. This would mark the stock's first time ending above its $38.62 closing price from June 20, 2019, according to Dow Jones Market Data. That was the stock's first day of trading after Slack's direct listing. Slack's Wednesday rally comes after fellow stay-home enterprise technology beneficiary Zoom Video Communications Inc.  posted far better-than-expected results for its March quarter. Slack is due to post its own earnings Thursday afternoon. ""We think Zoom setup heading into 1Q earnings was comparable to Slack tomorrow - both stocks have doubled since mid-March,"" MKM Partners analyst Rohit Kulka..."
2020-06-03 11:53:43 -0400,"Zoom Video Stock Rises As Analysts Debate Valuation, Phone Product Growth","Zoom Video stock rose as analysts debated its lofty valuation in the wake of its earnings report and guidance, which topped expectations. Analysts focused on growth of a new phone."
2020-06-03 11:12:03 -0400,"Zoom Video Q1 Earnings Top Estimates, Revenues Jump Y/Y","Zoom Video's (ZM) first-quarter fiscal 2021 results reflect solid user growth, driven by coronavirus-led remote working and Internet education wave."
2020-06-03 10:25:44 -0400,"Dow Jones Jumps 275 Points, As Civil Unrest Continues; Apple Nears All-Time Highs, While CrowdStrike, Zoom Video Report Earnings",The major stock indexes were higher early Wednesday amid continued civil unrest and payroll data. Apple neared an all-time high.
2020-06-03 10:05:20 -0400,"Zoom posts huge revenue, earnings beats",Yahoo Finance’s Alexis Christoforous and Brian Sozzi break down Zoom’s Q1 earnings report with JMP Securities Senior Analyst Pat Walravens.
2020-06-03 10:00:00 -0400,"MONDAY DEADLINE ALERT: The Schall Law Firm Announces the Filing of a Class Action Lawsuit Against Zoom Video Communications, Inc. and Encourages Investors with Losses in Excess of $100,000 to Contact the Firm","Los Angeles, California--(Newsfile Corp. - June 3, 2020) - The Schall Law Firm, a national shareholder rights litigation firm, announces the filing of a class action lawsuit against Zoom Video Communications, Inc. (NASDAQ: ZM) (""Zoom"" or ""the Company"") for violations of §§10(b) and 20(a) of the Securities Exchange Act of 1934 and Rule 10b-5 promulgated thereunder by the U.S. Securities and Exchange Commission.Investors who purchased the Company's securities between April 18, 2019 and April 6, 2020, ..."
2020-06-03 09:58:00 -0400,"Nasdaq Today: After Strong Earnings, Will Zoom Video Stock Keep Climbing?","The stock market has been extremely volatile since the coronavirus pandemic began, and its recovery has been at least as impressive as its initial plunge in late February and March.  The Nasdaq Composite (NASDAQINDEX: ^IXIC) has soared 40% from its March lows, and it's within just a couple of percentage points of a new all-time record high.  Nasdaq stocks that have demonstrated an ability to thrive during the coronavirus crisis have gone a long way toward helping the index bounce back."
2020-06-03 09:35:00 -0400,3 Top Hot Stocks to Watch in June,"Shares of Zoom Video (NASDAQ: ZM), CrowdStrike (NASDAQ: CRWD), and Axon Enterprise (NASDAQ: AAXN) are kicking off the first week of June with big gains following improving fundamentals and, in some cases, better-than-expected earnings reports.  Zoom Video, CrowdStrike, and Axon Enterprises are hot.  Everyone figured Zoom would hit one over the fence for Tuesday afternoon's quarterly earnings swing."
2020-06-03 08:09:26 -0400,"Dow Jones Today, Futures Rise As Covid Data Hits Milestone; CrowdStrike, MicroChip Soar: Nasdaq Eyes Record High","CrowdStrike and MicroChip were early high fliers Wednesday, as Boeing led the Dow Jones today and the Nasdaq eyed a new record high."
2020-06-03 06:23:00 -0400,"Zoom Smashes Q1 Earnings Forecasts Amid Work-From-Home Surge, But Rising Costs, Margin Pressures Cap Gains","Zoom said elevated demand for its online conferencing, as well as rising costs, will likely trim near-term profit margins."
